transformer-NCHW-B1-cuda.json
{"i": [["[\"05d32739313d2a19142800613f16c3b9\", 20, 32, 512, 20, 32, 2048, 1, 512, 2048, 512, 20, 32, 512]", "cuda -keys=cuda,gpu -max_num_threads=1024 -thread_warp_size=32", [-1, 16, 64, 49152, 2147483647, 1024, 8, 32], "", 0, []], [[], [["CI", 5], ["SP", 3, 0, 20, [1, 1, 2, 5], 1], ["SP", 3, 5, 32, [1, 4, 2, 2], 1], ["SP", 3, 10, 512, [1, 64, 2, 2], 1], ["SP", 3, 15, 2048, [1, 4], 1], ["RE", 3, [0, 5, 10, 1, 6, 11, 2, 7, 12, 15, 16, 3, 8, 13, 17, 4, 9, 14]], ["FSP", 6, 0, 1, 3], ["FSP", 6, 4, 2, 3], ["FSP", 6, 8, 3, 3], ["RE", 6, [0, 4, 8, 1, 5, 9, 2, 6, 10, 3, 7, 11]], ["CA", 3, 6, 8], ["CHR", 2, "shared", [3]], ["CA", 3, 4, 9], ["CHR", 1, "shared", [4]], ["CA", 2, 5, 9], ["FU", 8, [0, 1, 2]], ["AN", 8, 0, 5], ["FU", 8, [1, 2, 3]], ["AN", 8, 1, 4], ["FU", 8, [2, 3, 4]], ["AN", 8, 2, 6], ["FU", 4, [0, 1, 2]], ["SP", 4, 0, 8, [1], 1], ["AN", 4, 1, 2], ["FFSP", 4, 0, [3, 2, 1], 1, 1], ["AN", 4, 1, 6], ["FU", 2, [0, 1, 2]], ["SP", 2, 0, 160, [1], 1], ["AN", 2, 1, 2], ["FFSP", 2, 0, [3, 2, 1], 1, 1], ["AN", 2, 1, 6], ["PR", 5, 0, "auto_unroll_max_step$1024"]]]], "r": [[0.00107881], 0, 2.35598, 1618381986], "v": "v0.6"}
{"i": [["[\"05d32739313d2a19142800613f16c3b9\", 20, 32, 512, 20, 32, 2048, 1, 512, 2048, 512, 20, 32, 512]", "cuda -keys=cuda,gpu -max_num_threads=1024 -thread_warp_size=32", [-1, 16, 64, 49152, 2147483647, 1024, 8, 32], "", 0, []], [[], [["CI", 5], ["SP", 3, 0, 20, [1, 10, 1, 1], 1], ["SP", 3, 5, 32, [2, 2, 4, 2], 1], ["SP", 3, 10, 512, [1, 8, 4, 16], 1], ["SP", 3, 15, 2048, [1, 8], 1], ["RE", 3, [0, 5, 10, 1, 6, 11, 2, 7, 12, 15, 16, 3, 8, 13, 17, 4, 9, 14]], ["FSP", 6, 0, 1, 3], ["FSP", 6, 4, 2, 3], ["FSP", 6, 8, 3, 3], ["RE", 6, [0, 4, 8, 1, 5, 9, 2, 6, 10, 3, 7, 11]], ["CA", 3, 6, 8], ["CHR", 2, "shared", [3]], ["CA", 3, 4, 9], ["CHR", 1, "shared", [4]], ["CA", 2, 5, 9], ["FU", 8, [0, 1, 2]], ["AN", 8, 0, 5], ["FU", 8, [1, 2, 3]], ["AN", 8, 1, 4], ["FU", 8, [2, 3, 4]], ["AN", 8, 2, 6], ["FU", 4, [0, 1, 2]], ["SP", 4, 0, 512, [1], 1], ["AN", 4, 1, 2], ["FFSP", 4, 0, [3, 2, 1], 1, 1], ["AN", 4, 1, 6], ["FU", 2, [0, 1, 2]], ["SP", 2, 0, 64, [1], 1], ["AN", 2, 1, 2], ["FFSP", 2, 0, [3, 2, 1], 1, 1], ["AN", 2, 1, 6], ["PR", 5, 0, "auto_unroll_max_step$16"]]]], "r": [[0.0156926], 0, 1.87931, 1618381987], "v": "v0.6"}
{"i": [["[\"05d32739313d2a19142800613f16c3b9\", 20, 32, 512, 20, 32, 2048, 1, 512, 2048, 512, 20, 32, 512]", "cuda -keys=cuda,gpu -max_num_threads=1024 -thread_warp_size=32", [-1, 16, 64, 49152, 2147483647, 1024, 8, 32], "", 0, []], [[], [["CI", 5], ["SP", 3, 0, 20, [1, 2, 1, 2], 1], ["SP", 3, 5, 32, [4, 1, 2, 4], 1], ["SP", 3, 10, 512, [1, 16, 16, 2], 1], ["SP", 3, 15, 2048, [2, 8], 1], ["RE", 3, [0, 5, 10, 1, 6, 11, 2, 7, 12, 15, 16, 3, 8, 13, 17, 4, 9, 14]], ["FSP", 6, 0, 1, 3], ["FSP", 6, 4, 2, 3], ["FSP", 6, 8, 3, 3], ["RE", 6, [0, 4, 8, 1, 5, 9, 2, 6, 10, 3, 7, 11]], ["CA", 3, 6, 8], ["CHR", 2, "shared", [3]], ["CA", 3, 4, 9], ["CHR", 1, "shared", [4]], ["CA", 2, 5, 9], ["FU", 8, [0, 1, 2]], ["AN", 8, 0, 5], ["FU", 8, [1, 2, 3]], ["AN", 8, 1, 4], ["FU", 8, [2, 3, 4]], ["AN", 8, 2, 6], ["FU", 4, [0, 1, 2]], ["SP", 4, 0, 512, [1], 1], ["AN", 4, 1, 2], ["FFSP", 4, 0, [3, 2, 1], 1, 1], ["AN", 4, 1, 6], ["FU", 2, [0, 1, 2]], ["SP", 2, 0, 256, [1], 1], ["AN", 2, 1, 2], ["FFSP", 2, 0, [3, 2, 1], 1, 1], ["AN", 2, 1, 6], ["PR", 5, 0, "auto_unroll_max_step$1024"]]]], "r": [[0.0256985], 0, 5.48095, 1618381988], "v": "v0.6"}
{"i": [["[\"05d32739313d2a19142800613f16c3b9\", 20, 32, 512, 20, 32, 2048, 1, 512, 2048, 512, 20, 32, 512]", "cuda -keys=cuda,gpu -max_num_threads=1024 -thread_warp_size=32", [-1, 16, 64, 49152, 2147483647, 1024, 8, 32], "", 0, []], [[], [["CI", 5], ["SP", 3, 0, 20, [1, 1, 5, 2], 1], ["SP", 3, 5, 32, [4, 1, 2, 4], 1], ["SP", 3, 10, 512, [1, 32, 2, 4], 1], ["SP", 3, 15, 2048, [2, 1], 1], ["RE", 3, [0, 5, 10, 1, 6, 11, 2, 7, 12, 15, 16, 3, 8, 13, 17, 4, 9, 14]], ["FSP", 6, 0, 1, 3], ["FSP", 6, 4, 2, 3], ["FSP", 6, 8, 3, 3], ["RE", 6, [0, 4, 8, 1, 5, 9, 2, 6, 10, 3, 7, 11]], ["CA", 3, 6, 8], ["CHR", 2, "shared", [3]], ["CA", 3, 4, 9], ["CHR", 1, "shared", [4]], ["CA", 2, 5, 9], ["FU", 8, [0, 1, 2]], ["AN", 8, 0, 5], ["FU", 8, [1, 2, 3]], ["AN", 8, 1, 4], ["FU", 8, [2, 3, 4]], ["AN", 8, 2, 6], ["FU", 4, [0, 1, 2]], ["SP", 4, 0, 16, [1], 1], ["AN", 4, 1, 2], ["FFSP", 4, 0, [3, 2, 1], 1, 1], ["AN", 4, 1, 6], ["FU", 2, [0, 1, 2]], ["SP", 2, 0, 160, [1], 1], ["AN", 2, 1, 2], ["FFSP", 2, 0, [3, 2, 1], 1, 1], ["AN", 2, 1, 6], ["PR", 5, 0, "auto_unroll_max_step$1024"]]]], "r": [[0.0368538], 0, 4.16346, 1618381989], "v": "v0.6"}
{"i": [["[\"05d32739313d2a19142800613f16c3b9\", 20, 32, 512, 20, 32, 2048, 1, 512, 2048, 512, 20, 32, 512]", "cuda -keys=cuda,gpu -max_num_threads=1024 -thread_warp_size=32", [-1, 16, 64, 49152, 2147483647, 1024, 8, 32], "", 0, []], [[], [["CI", 5], ["SP", 3, 0, 20, [1, 5, 1, 1], 1], ["SP", 3, 5, 32, [4, 4, 2, 1], 1], ["SP", 3, 10, 512, [1, 8, 2, 8], 1], ["SP", 3, 15, 2048, [1, 2], 1], ["RE", 3, [0, 5, 10, 1, 6, 11, 2, 7, 12, 15, 16, 3, 8, 13, 17, 4, 9, 14]], ["FSP", 6, 0, 1, 3], ["FSP", 6, 4, 2, 3], ["FSP", 6, 8, 3, 3], ["RE", 6, [0, 4, 8, 1, 5, 9, 2, 6, 10, 3, 7, 11]], ["CA", 3, 6, 8], ["CHR", 2, "shared", [3]], ["CA", 3, 4, 9], ["CHR", 1, "shared", [4]], ["CA", 2, 5, 9], ["FU", 8, [0, 1, 2]], ["AN", 8, 0, 5], ["FU", 8, [1, 2, 3]], ["AN", 8, 1, 4], ["FU", 8, [2, 3, 4]], ["AN", 8, 2, 6], ["FU", 4, [0, 1, 2]], ["SP", 4, 0, 32, [32], 1], ["AN", 4, 1, 2], ["FFSP", 4, 0, [3, 2, 1], 1, 1], ["AN", 4, 1, 6], ["FU", 2, [0, 1, 2]], ["SP", 2, 0, 16, [1], 1], ["AN", 2, 1, 2], ["FFSP", 2, 0, [3, 2, 1], 1, 1], ["AN", 2, 1, 6], ["PR", 5, 0, "auto_unroll_max_step$1024"]]]], "r": [[0.00164162], 0, 1.73706, 1618381990], "v": "v0.6"}
{"i": [["[\"05d32739313d2a19142800613f16c3b9\", 20, 32, 512, 20, 32, 2048, 1, 512, 2048, 512, 20, 32, 512]", "cuda -keys=cuda,gpu -max_num_threads=1024 -thread_warp_size=32", [-1, 16, 64, 49152, 2147483647, 1024, 8, 32], "", 0, []], [[], [["CI", 5], ["SP", 3, 0, 20, [1, 4, 1, 1], 1], ["SP", 3, 5, 32, [1, 1, 1, 2], 1], ["SP", 3, 10, 512, [2, 4, 4, 1], 1], ["SP", 3, 15, 2048, [8, 2], 1], ["RE", 3, [0, 5, 10, 1, 6, 11, 2, 7, 12, 15, 16, 3, 8, 13, 17, 4, 9, 14]], ["FSP", 6, 0, 1, 3], ["FSP", 6, 4, 2, 3], ["FSP", 6, 8, 3, 3], ["RE", 6, [0, 4, 8, 1, 5, 9, 2, 6, 10, 3, 7, 11]], ["CA", 3, 6, 8], ["CHR", 2, "shared", [3]], ["CA", 3, 4, 9], ["CHR", 1, "shared", [4]], ["CA", 2, 5, 9], ["FU", 8, [0, 1, 2]], ["AN", 8, 0, 5], ["FU", 8, [1, 2, 3]], ["AN", 8, 1, 4], ["FU", 8, [2, 3, 4]], ["AN", 8, 2, 6], ["FU", 4, [0, 1, 2]], ["SP", 4, 0, 64, [1], 1], ["AN", 4, 1, 2], ["FFSP", 4, 0, [3, 2, 1], 1, 1], ["AN", 4, 1, 6], ["FU", 2, [0, 1, 2]], ["SP", 2, 0, 32, [1], 1], ["AN", 2, 1, 2], ["FFSP", 2, 0, [3, 2, 1], 1, 1], ["AN", 2, 1, 6], ["PR", 5, 0, "auto_unroll_max_step$1024"]]]], "r": [[0.000995106], 0, 1.43443, 1618381991], "v": "v0.6"}
{"i": [["[\"05d32739313d2a19142800613f16c3b9\", 20, 32, 512, 20, 32, 2048, 1, 512, 2048, 512, 20, 32, 512]", "cuda -keys=cuda,gpu -max_num_threads=1024 -thread_warp_size=32", [-1, 16, 64, 49152, 2147483647, 1024, 8, 32], "", 0, []], [[], [["CI", 5], ["SP", 3, 0, 20, [2, 10, 1, 1], 1], ["SP", 3, 5, 32, [1, 1, 4, 1], 1], ["SP", 3, 10, 512, [2, 16, 1, 8], 1], ["SP", 3, 15, 2048, [16, 1], 1], ["RE", 3, [0, 5, 10, 1, 6, 11, 2, 7, 12, 15, 16, 3, 8, 13, 17, 4, 9, 14]], ["FSP", 6, 0, 1, 3], ["FSP", 6, 4, 2, 3], ["FSP", 6, 8, 3, 3], ["RE", 6, [0, 4, 8, 1, 5, 9, 2, 6, 10, 3, 7, 11]], ["CA", 3, 6, 8], ["CHR", 2, "shared", [3]], ["CA", 3, 4, 9], ["CHR", 1, "shared", [4]], ["CA", 2, 5, 9], ["FU", 8, [0, 1, 2]], ["AN", 8, 0, 5], ["FU", 8, [1, 2, 3]], ["AN", 8, 1, 4], ["FU", 8, [2, 3, 4]], ["AN", 8, 2, 6], ["FU", 4, [0, 1, 2]], ["SP", 4, 0, 256, [1], 1], ["AN", 4, 1, 2], ["FFSP", 4, 0, [3, 2, 1], 1, 1], ["AN", 4, 1, 6], ["FU", 2, [0, 1, 2]], ["SP", 2, 0, 64, [1], 1], ["AN", 2, 1, 2], ["FFSP", 2, 0, [3, 2, 1], 1, 1], ["AN", 2, 1, 6], ["PR", 5, 0, "auto_unroll_max_step$512"]]]], "r": [[0.00169348], 0, 1.51258, 1618381992], "v": "v0.6"}
{"i": [["[\"05d32739313d2a19142800613f16c3b9\", 20, 32, 512, 20, 32, 2048, 1, 512, 2048, 512, 20, 32, 512]", "cuda -keys=cuda,gpu -max_num_threads=1024 -thread_warp_size=32", [-1, 16, 64, 49152, 2147483647, 1024, 8, 32], "", 0, []], [[], [["CI", 5], ["SP", 3, 0, 20, [1, 1, 1, 4], 1], ["SP", 3, 5, 32, [2, 16, 1, 1], 1], ["SP", 3, 10, 512, [1, 4, 2, 64], 1], ["SP", 3, 15, 2048, [2, 2], 1], ["RE", 3, [0, 5, 10, 1, 6, 11, 2, 7, 12, 15, 16, 3, 8, 13, 17, 4, 9, 14]], ["FSP", 6, 0, 1, 3], ["FSP", 6, 4, 2, 3], ["FSP", 6, 8, 3, 3], ["RE", 6, [0, 4, 8, 1, 5, 9, 2, 6, 10, 3, 7, 11]], ["CA", 3, 6, 8], ["CHR", 2, "shared", [3]], ["CA", 3, 4, 9], ["CHR", 1, "shared", [4]], ["CA", 2, 5, 9], ["FU", 8, [0, 1, 2]], ["AN", 8, 0, 5], ["FU", 8, [1, 2, 3]], ["AN", 8, 1, 4], ["FU", 8, [2, 3, 4]], ["AN", 8, 2, 6], ["FU", 4, [0, 1, 2]], ["SP", 4, 0, 512, [1], 1], ["AN", 4, 1, 2], ["FFSP", 4, 0, [3, 2, 1], 1, 1], ["AN", 4, 1, 6], ["FU", 2, [0, 1, 2]], ["SP", 2, 0, 16, [1], 1], ["AN", 2, 1, 2], ["FFSP", 2, 0, [3, 2, 1], 1, 1], ["AN", 2, 1, 6], ["PR", 5, 0, "auto_unroll_max_step$0"]]]], "r": [[0.0260823], 0, 2.50267, 1618381993], "v": "v0.6"}
{"i": [["[\"80d6134352923bdfe7e42218368eed0f\", 20, 32, 512, 1, 2048, 512, 2048, 20, 32, 2048]", "cuda -keys=cuda,gpu -max_num_threads=1024 -thread_warp_size=32", [-1, 16, 64, 49152, 2147483647, 1024, 8, 32], "", 0, []], [[], [["CI", 4], ["SP", 2, 0, 20, [1, 1, 1, 4], 1], ["SP", 2, 5, 32, [2, 1, 2, 8], 1], ["SP", 2, 10, 2048, [2, 64, 2, 4], 1], ["SP", 2, 15, 512, [2, 1], 1], ["RE", 2, [0, 5, 10, 1, 6, 11, 2, 7, 12, 15, 16, 3, 8, 13, 17, 4, 9, 14]], ["FSP", 5, 0, 1, 3], ["FSP", 5, 4, 2, 3], ["FSP", 5, 8, 3, 3], ["RE", 5, [0, 4, 8, 1, 5, 9, 2, 6, 10, 3, 7, 11]], ["CA", 2, 5, 8], ["CHR", 1, "shared", [2]], ["CA", 2, 3, 9], ["CHR", 0, "shared", [3]], ["CA", 1, 4, 9], ["FU", 7, [0, 1, 2]], ["AN", 7, 0, 5], ["FU", 7, [1, 2, 3]], ["AN", 7, 1, 4], ["FU", 7, [2, 3, 4]], ["AN", 7, 2, 6], ["FU", 3, [0, 1, 2]], ["SP", 3, 0, 16, [1], 1], ["AN", 3, 1, 2], ["FFSP", 3, 0, [3, 2, 1], 1, 1], ["AN", 3, 1, 6], ["FU", 1, [0, 1, 2]], ["SP", 1, 0, 32, [2], 1], ["AN", 1, 1, 2], ["FFSP", 1, 0, [3, 2, 1], 1, 1], ["AN", 1, 1, 6], ["PR", 4, 0, "auto_unroll_max_step$512"]]]], "r": [[0.123731], 0, 4.70781, 1618382002], "v": "v0.6"}
{"i": [["[\"80d6134352923bdfe7e42218368eed0f\", 20, 32, 512, 1, 2048, 512, 2048, 20, 32, 2048]", "cuda -keys=cuda,gpu -max_num_threads=1024 -thread_warp_size=32", [-1, 16, 64, 49152, 2147483647, 1024, 8, 32], "", 0, []], [[], [["CI", 4], ["SP", 2, 0, 20, [2, 5, 1, 2], 1], ["SP", 2, 5, 32, [4, 4, 1, 1], 1], ["SP", 2, 10, 2048, [1, 2, 16, 1], 1], ["SP", 2, 15, 512, [2, 8], 1], ["RE", 2, [0, 5, 10, 1, 6, 11, 2, 7, 12, 15, 16, 3, 8, 13, 17, 4, 9, 14]], ["FSP", 5, 0, 1, 3], ["FSP", 5, 4, 2, 3], ["FSP", 5, 8, 3, 3], ["RE", 5, [0, 4, 8, 1, 5, 9, 2, 6, 10, 3, 7, 11]], ["CA", 2, 5, 8], ["CHR", 1, "shared", [2]], ["CA", 2, 3, 9], ["CHR", 0, "shared", [3]], ["CA", 1, 4, 9], ["FU", 7, [0, 1, 2]], ["AN", 7, 0, 5], ["FU", 7, [1, 2, 3]], ["AN", 7, 1, 4], ["FU", 7, [2, 3, 4]], ["AN", 7, 2, 6], ["FU", 3, [0, 1, 2]], ["SP", 3, 0, 256, [1], 1], ["AN", 3, 1, 2], ["FFSP", 3, 0, [3, 2, 1], 1, 1], ["AN", 3, 1, 6], ["FU", 1, [0, 1, 2]], ["SP", 1, 0, 32, [4], 1], ["AN", 1, 1, 2], ["FFSP", 1, 0, [3, 2, 1], 1, 1], ["AN", 1, 1, 6], ["PR", 4, 0, "auto_unroll_max_step$0"]]]], "r": [[0.00255771], 0, 1.92121, 1618382003], "v": "v0.6"}
{"i": [["[\"80d6134352923bdfe7e42218368eed0f\", 20, 32, 512, 1, 2048, 512, 2048, 20, 32, 2048]", "cuda -keys=cuda,gpu -max_num_threads=1024 -thread_warp_size=32", [-1, 16, 64, 49152, 2147483647, 1024, 8, 32], "", 0, []], [[], [["CI", 4], ["SP", 2, 0, 20, [2, 2, 1, 5], 1], ["SP", 2, 5, 32, [1, 16, 1, 2], 1], ["SP", 2, 10, 2048, [1, 4, 32, 4], 1], ["SP", 2, 15, 512, [2, 2], 1], ["RE", 2, [0, 5, 10, 1, 6, 11, 2, 7, 12, 15, 16, 3, 8, 13, 17, 4, 9, 14]], ["FSP", 5, 0, 1, 3], ["FSP", 5, 4, 2, 3], ["FSP", 5, 8, 3, 3], ["RE", 5, [0, 4, 8, 1, 5, 9, 2, 6, 10, 3, 7, 11]], ["CA", 2, 5, 8], ["CHR", 1, "shared", [2]], ["CA", 2, 3, 9], ["CHR", 0, "shared", [3]], ["CA", 1, 4, 9], ["FU", 7, [0, 1, 2]], ["AN", 7, 0, 5], ["FU", 7, [1, 2, 3]], ["AN", 7, 1, 4], ["FU", 7, [2, 3, 4]], ["AN", 7, 2, 6], ["FU", 3, [0, 1, 2]], ["SP", 3, 0, 512, [1], 1], ["AN", 3, 1, 2], ["FFSP", 3, 0, [3, 2, 1], 1, 1], ["AN", 3, 1, 6], ["FU", 1, [0, 1, 2]], ["SP", 1, 0, 40, [8], 1], ["AN", 1, 1, 2], ["FFSP", 1, 0, [3, 2, 1], 1, 1], ["AN", 1, 1, 6], ["PR", 4, 0, "auto_unroll_max_step$16"]]]], "r": [[0.0101996], 0, 1.642, 1618382004], "v": "v0.6"}
{"i": [["[\"80d6134352923bdfe7e42218368eed0f\", 20, 32, 512, 1, 2048, 512, 2048, 20, 32, 2048]", "cuda -keys=cuda,gpu -max_num_threads=1024 -thread_warp_size=32", [-1, 16, 64, 49152, 2147483647, 1024, 8, 32], "", 0, []], [[], [["CI", 4], ["SP", 2, 0, 20, [1, 1, 5, 2], 1], ["SP", 2, 5, 32, [2, 1, 2, 4], 1], ["SP", 2, 10, 2048, [4, 128, 2, 1], 1], ["SP", 2, 15, 512, [2, 1], 1], ["RE", 2, [0, 5, 10, 1, 6, 11, 2, 7, 12, 15, 16, 3, 8, 13, 17, 4, 9, 14]], ["FSP", 5, 0, 1, 3], ["FSP", 5, 4, 2, 3], ["FSP", 5, 8, 3, 3], ["RE", 5, [0, 4, 8, 1, 5, 9, 2, 6, 10, 3, 7, 11]], ["CA", 2, 5, 8], ["CHR", 1, "shared", [2]], ["CA", 2, 3, 9], ["CHR", 0, "shared", [3]], ["CA", 1, 4, 9], ["FU", 7, [0, 1, 2]], ["AN", 7, 0, 5], ["FU", 7, [1, 2, 3]], ["AN", 7, 1, 4], ["FU", 7, [2, 3, 4]], ["AN", 7, 2, 6], ["FU", 3, [0, 1, 2]], ["SP", 3, 0, 4, [1], 1], ["AN", 3, 1, 2], ["FFSP", 3, 0, [3, 2, 1], 1, 1], ["AN", 3, 1, 6], ["FU", 1, [0, 1, 2]], ["SP", 1, 0, 160, [1], 1], ["AN", 1, 1, 2], ["FFSP", 1, 0, [3, 2, 1], 1, 1], ["AN", 1, 1, 6], ["PR", 4, 0, "auto_unroll_max_step$64"]]]], "r": [[0.0156237], 0, 1.98673, 1618382005], "v": "v0.6"}
{"i": [["[\"80d6134352923bdfe7e42218368eed0f\", 20, 32, 512, 1, 2048, 512, 2048, 20, 32, 2048]", "cuda -keys=cuda,gpu -max_num_threads=1024 -thread_warp_size=32", [-1, 16, 64, 49152, 2147483647, 1024, 8, 32], "", 0, []], [[], [["CI", 4], ["SP", 2, 0, 20, [1, 4, 1, 1], 1], ["SP", 2, 5, 32, [2, 1, 2, 8], 1], ["SP", 2, 10, 2048, [2, 64, 2, 4], 1], ["SP", 2, 15, 512, [1, 1], 1], ["RE", 2, [0, 5, 10, 1, 6, 11, 2, 7, 12, 15, 16, 3, 8, 13, 17, 4, 9, 14]], ["FSP", 5, 0, 1, 3], ["FSP", 5, 4, 2, 3], ["FSP", 5, 8, 3, 3], ["RE", 5, [0, 4, 8, 1, 5, 9, 2, 6, 10, 3, 7, 11]], ["CA", 2, 5, 8], ["CHR", 1, "shared", [2]], ["CA", 2, 3, 9], ["CHR", 0, "shared", [3]], ["CA", 1, 4, 9], ["FU", 7, [0, 1, 2]], ["AN", 7, 0, 5], ["FU", 7, [1, 2, 3]], ["AN", 7, 1, 4], ["FU", 7, [2, 3, 4]], ["AN", 7, 2, 6], ["FU", 3, [0, 1, 2]], ["SP", 3, 0, 16, [4], 1], ["AN", 3, 1, 2], ["FFSP", 3, 0, [3, 2, 1], 1, 1], ["AN", 3, 1, 6], ["FU", 1, [0, 1, 2]], ["SP", 1, 0, 32, [1], 1], ["AN", 1, 1, 2], ["FFSP", 1, 0, [3, 2, 1], 1, 1], ["AN", 1, 1, 6], ["PR", 4, 0, "auto_unroll_max_step$512"]]]], "r": [[0.00681111], 0, 2.5524, 1618382007], "v": "v0.6"}
{"i": [["[\"80d6134352923bdfe7e42218368eed0f\", 20, 32, 512, 1, 2048, 512, 2048, 20, 32, 2048]", "cuda -keys=cuda,gpu -max_num_threads=1024 -thread_warp_size=32", [-1, 16, 64, 49152, 2147483647, 1024, 8, 32], "", 0, []], [[], [["CI", 4], ["SP", 2, 0, 20, [1, 20, 1, 1], 1], ["SP", 2, 5, 32, [1, 2, 1, 2], 1], ["SP", 2, 10, 2048, [1, 2, 1, 64], 1], ["SP", 2, 15, 512, [1, 4], 1], ["RE", 2, [0, 5, 10, 1, 6, 11, 2, 7, 12, 15, 16, 3, 8, 13, 17, 4, 9, 14]], ["FSP", 5, 0, 1, 3], ["FSP", 5, 4, 2, 3], ["FSP", 5, 8, 3, 3], ["RE", 5, [0, 4, 8, 1, 5, 9, 2, 6, 10, 3, 7, 11]], ["CA", 2, 5, 8], ["CHR", 1, "shared", [2]], ["CA", 2, 3, 9], ["CHR", 0, "shared", [3]], ["CA", 1, 4, 9], ["FU", 7, [0, 1, 2]], ["AN", 7, 0, 5], ["FU", 7, [1, 2, 3]], ["AN", 7, 1, 4], ["FU", 7, [2, 3, 4]], ["AN", 7, 2, 6], ["FU", 3, [0, 1, 2]], ["SP", 3, 0, 256, [1], 1], ["AN", 3, 1, 2], ["FFSP", 3, 0, [3, 2, 1], 1, 1], ["AN", 3, 1, 6], ["FU", 1, [0, 1, 2]], ["SP", 1, 0, 8, [1], 1], ["AN", 1, 1, 2], ["FFSP", 1, 0, [3, 2, 1], 1, 1], ["AN", 1, 1, 6], ["PR", 4, 0, "auto_unroll_max_step$512"]]]], "r": [[0.00030817], 0, 2.23363, 1618382009], "v": "v0.6"}
{"i": [["[\"80d6134352923bdfe7e42218368eed0f\", 20, 32, 512, 1, 2048, 512, 2048, 20, 32, 2048]", "cuda -keys=cuda,gpu -max_num_threads=1024 -thread_warp_size=32", [-1, 16, 64, 49152, 2147483647, 1024, 8, 32], "", 0, []], [[], [["CI", 4], ["SP", 2, 0, 20, [1, 1, 1, 20], 1], ["SP", 2, 5, 32, [2, 1, 2, 4], 1], ["SP", 2, 10, 2048, [1, 128, 2, 2], 1], ["SP", 2, 15, 512, [1, 4], 1], ["RE", 2, [0, 5, 10, 1, 6, 11, 2, 7, 12, 15, 16, 3, 8, 13, 17, 4, 9, 14]], ["FSP", 5, 0, 1, 3], ["FSP", 5, 4, 2, 3], ["FSP", 5, 8, 3, 3], ["RE", 5, [0, 4, 8, 1, 5, 9, 2, 6, 10, 3, 7, 11]], ["CA", 2, 5, 8], ["CHR", 1, "shared", [2]], ["CA", 2, 3, 9], ["CHR", 0, "shared", [3]], ["CA", 1, 4, 9], ["FU", 7, [0, 1, 2]], ["AN", 7, 0, 5], ["FU", 7, [1, 2, 3]], ["AN", 7, 1, 4], ["FU", 7, [2, 3, 4]], ["AN", 7, 2, 6], ["FU", 3, [0, 1, 2]], ["SP", 3, 0, 16, [1], 1], ["AN", 3, 1, 2], ["FFSP", 3, 0, [3, 2, 1], 1, 1], ["AN", 3, 1, 6], ["FU", 1, [0, 1, 2]], ["SP", 1, 0, 320, [8], 1], ["AN", 1, 1, 2], ["FFSP", 1, 0, [3, 2, 1], 1, 1], ["AN", 1, 1, 6], ["PR", 4, 0, "auto_unroll_max_step$16"]]]], "r": [[0.0113397], 0, 1.82952, 1618382010], "v": "v0.6"}
{"i": [["[\"05d32739313d2a19142800613f16c3b9\", 20, 32, 512, 20, 32, 512, 1, 512, 512, 512, 20, 32, 512]", "cuda -keys=cuda,gpu -max_num_threads=1024 -thread_warp_size=32", [-1, 16, 64, 49152, 2147483647, 1024, 8, 32], "", 0, []], [[], [["CI", 5], ["SP", 3, 0, 20, [5, 2, 1, 2], 1], ["SP", 3, 5, 32, [1, 1, 1, 1], 1], ["SP", 3, 10, 512, [1, 32, 2, 1], 1], ["SP", 3, 15, 512, [2, 1], 1], ["RE", 3, [0, 5, 10, 1, 6, 11, 2, 7, 12, 15, 16, 3, 8, 13, 17, 4, 9, 14]], ["FSP", 6, 0, 1, 3], ["FSP", 6, 4, 2, 3], ["FSP", 6, 8, 3, 3], ["RE", 6, [0, 4, 8, 1, 5, 9, 2, 6, 10, 3, 7, 11]], ["CA", 3, 6, 8], ["CHR", 2, "shared", [3]], ["CA", 3, 4, 9], ["CHR", 1, "shared", [4]], ["CA", 2, 5, 9], ["FU", 8, [0, 1, 2]], ["AN", 8, 0, 5], ["FU", 8, [1, 2, 3]], ["AN", 8, 1, 4], ["FU", 8, [2, 3, 4]], ["AN", 8, 2, 6], ["FU", 4, [0, 1, 2]], ["SP", 4, 0, 16, [4], 1], ["AN", 4, 1, 2], ["FFSP", 4, 0, [3, 2, 1], 1, 1], ["AN", 4, 1, 6], ["FU", 2, [0, 1, 2]], ["SP", 2, 0, 16, [4], 1], ["AN", 2, 1, 2], ["FFSP", 2, 0, [3, 2, 1], 1, 1], ["AN", 2, 1, 6], ["PR", 5, 0, "auto_unroll_max_step$16"]]]], "r": [[0.000235206], 0, 1.63669, 1618382019], "v": "v0.6"}
{"i": [["[\"05d32739313d2a19142800613f16c3b9\", 20, 32, 512, 20, 32, 512, 1, 512, 512, 512, 20, 32, 512]", "cuda -keys=cuda,gpu -max_num_threads=1024 -thread_warp_size=32", [-1, 16, 64, 49152, 2147483647, 1024, 8, 32], "", 0, []], [[], [["CI", 5], ["SP", 3, 0, 20, [1, 2, 2, 5], 1], ["SP", 3, 5, 32, [1, 1, 1, 4], 1], ["SP", 3, 10, 512, [1, 64, 1, 8], 1], ["SP", 3, 15, 512, [8, 1], 1], ["RE", 3, [0, 5, 10, 1, 6, 11, 2, 7, 12, 15, 16, 3, 8, 13, 17, 4, 9, 14]], ["FSP", 6, 0, 1, 3], ["FSP", 6, 4, 2, 3], ["FSP", 6, 8, 3, 3], ["RE", 6, [0, 4, 8, 1, 5, 9, 2, 6, 10, 3, 7, 11]], ["CA", 3, 6, 8], ["CHR", 2, "shared", [3]], ["CA", 3, 4, 9], ["CHR", 1, "shared", [4]], ["CA", 2, 5, 9], ["FU", 8, [0, 1, 2]], ["AN", 8, 0, 5], ["FU", 8, [1, 2, 3]], ["AN", 8, 1, 4], ["FU", 8, [2, 3, 4]], ["AN", 8, 2, 6], ["FU", 4, [0, 1, 2]], ["SP", 4, 0, 64, [1], 1], ["AN", 4, 1, 2], ["FFSP", 4, 0, [3, 2, 1], 1, 1], ["AN", 4, 1, 6], ["FU", 2, [0, 1, 2]], ["SP", 2, 0, 32, [4], 1], ["AN", 2, 1, 2], ["FFSP", 2, 0, [3, 2, 1], 1, 1], ["AN", 2, 1, 6], ["PR", 5, 0, "auto_unroll_max_step$1024"]]]], "r": [[0.00129241], 0, 2.36137, 1618382020], "v": "v0.6"}
{"i": [["[\"05d32739313d2a19142800613f16c3b9\", 20, 32, 512, 20, 32, 512, 1, 512, 512, 512, 20, 32, 512]", "cuda -keys=cuda,gpu -max_num_threads=1024 -thread_warp_size=32", [-1, 16, 64, 49152, 2147483647, 1024, 8, 32], "", 0, []], [[], [["CI", 5], ["SP", 3, 0, 20, [2, 2, 1, 5], 1], ["SP", 3, 5, 32, [2, 4, 4, 1], 1], ["SP", 3, 10, 512, [1, 4, 4, 8], 1], ["SP", 3, 15, 512, [1, 1], 1], ["RE", 3, [0, 5, 10, 1, 6, 11, 2, 7, 12, 15, 16, 3, 8, 13, 17, 4, 9, 14]], ["FSP", 6, 0, 1, 3], ["FSP", 6, 4, 2, 3], ["FSP", 6, 8, 3, 3], ["RE", 6, [0, 4, 8, 1, 5, 9, 2, 6, 10, 3, 7, 11]], ["CA", 3, 6, 8], ["CHR", 2, "shared", [3]], ["CA", 3, 4, 9], ["CHR", 1, "shared", [4]], ["CA", 2, 5, 9], ["FU", 8, [0, 1, 2]], ["AN", 8, 0, 5], ["FU", 8, [1, 2, 3]], ["AN", 8, 1, 4], ["FU", 8, [2, 3, 4]], ["AN", 8, 2, 6], ["FU", 4, [0, 1, 2]], ["SP", 4, 0, 32, [1], 1], ["AN", 4, 1, 2], ["FFSP", 4, 0, [3, 2, 1], 1, 1], ["AN", 4, 1, 6], ["FU", 2, [0, 1, 2]], ["SP", 2, 0, 20, [1], 1], ["AN", 2, 1, 2], ["FFSP", 2, 0, [3, 2, 1], 1, 1], ["AN", 2, 1, 6], ["PR", 5, 0, "auto_unroll_max_step$1024"]]]], "r": [[0.0143923], 0, 4.92745, 1618382022], "v": "v0.6"}
{"i": [["[\"05d32739313d2a19142800613f16c3b9\", 20, 32, 512, 20, 32, 512, 1, 512, 512, 512, 20, 32, 512]", "cuda -keys=cuda,gpu -max_num_threads=1024 -thread_warp_size=32", [-1, 16, 64, 49152, 2147483647, 1024, 8, 32], "", 0, []], [[], [["CI", 5], ["SP", 3, 0, 20, [1, 5, 1, 1], 1], ["SP", 3, 5, 32, [1, 1, 2, 2], 1], ["SP", 3, 10, 512, [1, 64, 2, 1], 1], ["SP", 3, 15, 512, [32, 1], 1], ["RE", 3, [0, 5, 10, 1, 6, 11, 2, 7, 12, 15, 16, 3, 8, 13, 17, 4, 9, 14]], ["FSP", 6, 0, 1, 3], ["FSP", 6, 4, 2, 3], ["FSP", 6, 8, 3, 3], ["RE", 6, [0, 4, 8, 1, 5, 9, 2, 6, 10, 3, 7, 11]], ["CA", 3, 6, 8], ["CHR", 2, "shared", [3]], ["CA", 3, 4, 9], ["CHR", 1, "shared", [4]], ["CA", 2, 5, 9], ["FU", 8, [0, 1, 2]], ["AN", 8, 0, 5], ["FU", 8, [1, 2, 3]], ["AN", 8, 1, 4], ["FU", 8, [2, 3, 4]], ["AN", 8, 2, 6], ["FU", 4, [0, 1, 2]], ["SP", 4, 0, 64, [1], 1], ["AN", 4, 1, 2], ["FFSP", 4, 0, [3, 2, 1], 1, 1], ["AN", 4, 1, 6], ["FU", 2, [0, 1, 2]], ["SP", 2, 0, 64, [64], 1], ["AN", 2, 1, 2], ["FFSP", 2, 0, [3, 2, 1], 1, 1], ["AN", 2, 1, 6], ["PR", 5, 0, "auto_unroll_max_step$512"]]]], "r": [[0.000230692], 0, 2.00242, 1618382023], "v": "v0.6"}
{"i": [["[\"05d32739313d2a19142800613f16c3b9\", 20, 32, 512, 20, 32, 512, 1, 512, 512, 512, 20, 32, 512]", "cuda -keys=cuda,gpu -max_num_threads=1024 -thread_warp_size=32", [-1, 16, 64, 49152, 2147483647, 1024, 8, 32], "", 0, []], [[], [["CI", 5], ["SP", 3, 0, 20, [1, 4, 5, 1], 1], ["SP", 3, 5, 32, [1, 2, 8, 1], 1], ["SP", 3, 10, 512, [2, 8, 4, 4], 1], ["SP", 3, 15, 512, [2, 2], 1], ["RE", 3, [0, 5, 10, 1, 6, 11, 2, 7, 12, 15, 16, 3, 8, 13, 17, 4, 9, 14]], ["FSP", 6, 0, 1, 3], ["FSP", 6, 4, 2, 3], ["FSP", 6, 8, 3, 3], ["RE", 6, [0, 4, 8, 1, 5, 9, 2, 6, 10, 3, 7, 11]], ["CA", 3, 6, 8], ["CHR", 2, "shared", [3]], ["CA", 3, 4, 9], ["CHR", 1, "shared", [4]], ["CA", 2, 5, 9], ["FU", 8, [0, 1, 2]], ["AN", 8, 0, 5], ["FU", 8, [1, 2, 3]], ["AN", 8, 1, 4], ["FU", 8, [2, 3, 4]], ["AN", 8, 2, 6], ["FU", 4, [0, 1, 2]], ["SP", 4, 0, 64, [1], 1], ["AN", 4, 1, 2], ["FFSP", 4, 0, [3, 2, 1], 1, 1], ["AN", 4, 1, 6], ["FU", 2, [0, 1, 2]], ["SP", 2, 0, 160, [1], 1], ["AN", 2, 1, 2], ["FFSP", 2, 0, [3, 2, 1], 1, 1], ["AN", 2, 1, 6], ["PR", 5, 0, "auto_unroll_max_step$1024"]]]], "r": [[0.00492473], 0, 2.73534, 1618382024], "v": "v0.6"}
{"i": [["[\"05d32739313d2a19142800613f16c3b9\", 20, 32, 512, 20, 32, 512, 1, 512, 512, 512, 20, 32, 512]", "cuda -keys=cuda,gpu -max_num_threads=1024 -thread_warp_size=32", [-1, 16, 64, 49152, 2147483647, 1024, 8, 32], "", 0, []], [[], [["CI", 5], ["SP", 3, 0, 20, [1, 1, 10, 1], 1], ["SP", 3, 5, 32, [4, 2, 1, 1], 1], ["SP", 3, 10, 512, [1, 128, 2, 1], 1], ["SP", 3, 15, 512, [2, 1], 1], ["RE", 3, [0, 5, 10, 1, 6, 11, 2, 7, 12, 15, 16, 3, 8, 13, 17, 4, 9, 14]], ["FSP", 6, 0, 1, 3], ["FSP", 6, 4, 2, 3], ["FSP", 6, 8, 3, 3], ["RE", 6, [0, 4, 8, 1, 5, 9, 2, 6, 10, 3, 7, 11]], ["CA", 3, 6, 8], ["CHR", 2, "shared", [3]], ["CA", 3, 4, 9], ["CHR", 1, "shared", [4]], ["CA", 2, 5, 9], ["FU", 8, [0, 1, 2]], ["AN", 8, 0, 5], ["FU", 8, [1, 2, 3]], ["AN", 8, 1, 4], ["FU", 8, [2, 3, 4]], ["AN", 8, 2, 6], ["FU", 4, [0, 1, 2]], ["SP", 4, 0, 4, [1], 1], ["AN", 4, 1, 2], ["FFSP", 4, 0, [3, 2, 1], 1, 1], ["AN", 4, 1, 6], ["FU", 2, [0, 1, 2]], ["SP", 2, 0, 80, [1], 1], ["AN", 2, 1, 2], ["FFSP", 2, 0, [3, 2, 1], 1, 1], ["AN", 2, 1, 6], ["PR", 5, 0, "auto_unroll_max_step$0"]]]], "r": [[0.00020986], 0, 1.75735, 1618382025], "v": "v0.6"}
{"i": [["[\"05d32739313d2a19142800613f16c3b9\", 20, 32, 512, 20, 32, 512, 1, 512, 512, 512, 20, 32, 512]", "cuda -keys=cuda,gpu -max_num_threads=1024 -thread_warp_size=32", [-1, 16, 64, 49152, 2147483647, 1024, 8, 32], "", 0, []], [[], [["CI", 5], ["SP", 3, 0, 20, [4, 1, 1, 5], 1], ["SP", 3, 5, 32, [1, 2, 1, 4], 1], ["SP", 3, 10, 512, [1, 128, 2, 1], 1], ["SP", 3, 15, 512, [1, 8], 1], ["RE", 3, [0, 5, 10, 1, 6, 11, 2, 7, 12, 15, 16, 3, 8, 13, 17, 4, 9, 14]], ["FSP", 6, 0, 1, 3], ["FSP", 6, 4, 2, 3], ["FSP", 6, 8, 3, 3], ["RE", 6, [0, 4, 8, 1, 5, 9, 2, 6, 10, 3, 7, 11]], ["CA", 3, 6, 8], ["CHR", 2, "shared", [3]], ["CA", 3, 4, 9], ["CHR", 1, "shared", [4]], ["CA", 2, 5, 9], ["FU", 8, [0, 1, 2]], ["AN", 8, 0, 5], ["FU", 8, [1, 2, 3]], ["AN", 8, 1, 4], ["FU", 8, [2, 3, 4]], ["AN", 8, 2, 6], ["FU", 4, [0, 1, 2]], ["SP", 4, 0, 32, [1], 1], ["AN", 4, 1, 2], ["FFSP", 4, 0, [3, 2, 1], 1, 1], ["AN", 4, 1, 6], ["FU", 2, [0, 1, 2]], ["SP", 2, 0, 160, [1], 1], ["AN", 2, 1, 2], ["FFSP", 2, 0, [3, 2, 1], 1, 1], ["AN", 2, 1, 6], ["PR", 5, 0, "auto_unroll_max_step$16"]]]], "r": [[0.00077602], 0, 2.00833, 1618382026], "v": "v0.6"}
{"i": [["[\"05d32739313d2a19142800613f16c3b9\", 20, 32, 512, 20, 32, 512, 1, 512, 512, 512, 20, 32, 512]", "cuda -keys=cuda,gpu -max_num_threads=1024 -thread_warp_size=32", [-1, 16, 64, 49152, 2147483647, 1024, 8, 32], "", 0, []], [[], [["CI", 5], ["SP", 3, 0, 20, [2, 5, 1, 1], 1], ["SP", 3, 5, 32, [2, 4, 1, 1], 1], ["SP", 3, 10, 512, [1, 32, 8, 2], 1], ["SP", 3, 15, 512, [2, 4], 1], ["RE", 3, [0, 5, 10, 1, 6, 11, 2, 7, 12, 15, 16, 3, 8, 13, 17, 4, 9, 14]], ["FSP", 6, 0, 1, 3], ["FSP", 6, 4, 2, 3], ["FSP", 6, 8, 3, 3], ["RE", 6, [0, 4, 8, 1, 5, 9, 2, 6, 10, 3, 7, 11]], ["CA", 3, 6, 8], ["CHR", 2, "shared", [3]], ["CA", 3, 4, 9], ["CHR", 1, "shared", [4]], ["CA", 2, 5, 9], ["FU", 8, [0, 1, 2]], ["AN", 8, 0, 5], ["FU", 8, [1, 2, 3]], ["AN", 8, 1, 4], ["FU", 8, [2, 3, 4]], ["AN", 8, 2, 6], ["FU", 4, [0, 1, 2]], ["SP", 4, 0, 128, [1], 1], ["AN", 4, 1, 2], ["FFSP", 4, 0, [3, 2, 1], 1, 1], ["AN", 4, 1, 6], ["FU", 2, [0, 1, 2]], ["SP", 2, 0, 8, [1], 1], ["AN", 2, 1, 2], ["FFSP", 2, 0, [3, 2, 1], 1, 1], ["AN", 2, 1, 6], ["PR", 5, 0, "auto_unroll_max_step$0"]]]], "r": [[0.00106956], 0, 1.82894, 1618382028], "v": "v0.6"}
{"i": [["[\"d2a28fdf41e83222456f5a6e5bf8a24a\", 256, 20, 10, 256, 64, 10, 256, 20, 64]", "cuda -keys=cuda,gpu -max_num_threads=1024 -thread_warp_size=32", [-1, 16, 64, 49152, 2147483647, 1024, 8, 32], "", 0, []], [[], [["CHW", 2, "local"], ["SP", 2, 0, 256, [1, 8, 2, 1], 1], ["SP", 2, 5, 20, [1, 2, 2, 5], 1], ["SP", 2, 10, 64, [1, 16, 2, 2], 1], ["SP", 2, 15, 10, [1, 1], 1], ["RE", 2, [0, 5, 10, 1, 6, 11, 2, 7, 12, 15, 16, 3, 8, 13, 17, 4, 9, 14]], ["FSP", 3, 0, 1, 3], ["FSP", 3, 4, 2, 3], ["FSP", 3, 8, 3, 3], ["RE", 3, [0, 4, 8, 1, 5, 9, 2, 6, 10, 3, 7, 11]], ["CA", 2, 3, 8], ["CHR", 1, "shared", [2]], ["CA", 2, 3, 9], ["CHR", 0, "shared", [3]], ["CA", 1, 4, 9], ["FU", 5, [0, 1, 2]], ["AN", 5, 0, 5], ["FU", 5, [1, 2, 3]], ["AN", 5, 1, 4], ["FU", 5, [2, 3, 4]], ["AN", 5, 2, 6], ["FU", 3, [0, 1, 2]], ["SP", 3, 0, 8, [1], 1], ["AN", 3, 1, 2], ["FFSP", 3, 0, [3, 2, 1], 1, 1], ["AN", 3, 1, 6], ["FU", 1, [0, 1, 2]], ["SP", 1, 0, 20, [1], 1], ["AN", 1, 1, 2], ["FFSP", 1, 0, [3, 2, 1], 1, 1], ["AN", 1, 1, 6], ["PR", 4, 0, "auto_unroll_max_step$1024"]]]], "r": [[1.09718e-05], 0, 2.47206, 1618382045], "v": "v0.6"}
{"i": [["[\"d2a28fdf41e83222456f5a6e5bf8a24a\", 256, 20, 10, 256, 64, 10, 256, 20, 64]", "cuda -keys=cuda,gpu -max_num_threads=1024 -thread_warp_size=32", [-1, 16, 64, 49152, 2147483647, 1024, 8, 32], "", 0, []], [[], [["CHW", 2, "local"], ["SP", 2, 0, 256, [1, 2, 1, 4], 1], ["SP", 2, 5, 20, [1, 10, 1, 1], 1], ["SP", 2, 10, 64, [4, 2, 1, 8], 1], ["SP", 2, 15, 10, [1, 2], 1], ["RE", 2, [0, 5, 10, 1, 6, 11, 2, 7, 12, 15, 16, 3, 8, 13, 17, 4, 9, 14]], ["FSP", 3, 0, 1, 3], ["FSP", 3, 4, 2, 3], ["FSP", 3, 8, 3, 3], ["RE", 3, [0, 4, 8, 1, 5, 9, 2, 6, 10, 3, 7, 11]], ["CA", 2, 3, 8], ["CHR", 1, "shared", [2]], ["CA", 2, 3, 9], ["CHR", 0, "shared", [3]], ["CA", 1, 4, 9], ["FU", 5, [0, 1, 2]], ["AN", 5, 0, 5], ["FU", 5, [1, 2, 3]], ["AN", 5, 1, 4], ["FU", 5, [2, 3, 4]], ["AN", 5, 2, 6], ["FU", 3, [0, 1, 2]], ["SP", 3, 0, 128, [16], 1], ["AN", 3, 1, 2], ["FFSP", 3, 0, [3, 2, 1], 1, 1], ["AN", 3, 1, 6], ["FU", 1, [0, 1, 2]], ["SP", 1, 0, 16, [2], 1], ["AN", 1, 1, 2], ["FFSP", 1, 0, [3, 2, 1], 1, 1], ["AN", 1, 1, 6], ["PR", 4, 0, "auto_unroll_max_step$512"]]]], "r": [[1.65731e-05], 0, 2.04233, 1618382046], "v": "v0.6"}
{"i": [["[\"d2a28fdf41e83222456f5a6e5bf8a24a\", 256, 20, 10, 256, 64, 10, 256, 20, 64]", "cuda -keys=cuda,gpu -max_num_threads=1024 -thread_warp_size=32", [-1, 16, 64, 49152, 2147483647, 1024, 8, 32], "", 0, []], [[], [["CHW", 2, "local"], ["SP", 2, 0, 256, [1, 1, 1, 16], 1], ["SP", 2, 5, 20, [1, 10, 1, 2], 1], ["SP", 2, 10, 64, [2, 8, 4, 1], 1], ["SP", 2, 15, 10, [2, 1], 1], ["RE", 2, [0, 5, 10, 1, 6, 11, 2, 7, 12, 15, 16, 3, 8, 13, 17, 4, 9, 14]], ["FSP", 3, 0, 1, 3], ["FSP", 3, 4, 2, 3], ["FSP", 3, 8, 3, 3], ["RE", 3, [0, 4, 8, 1, 5, 9, 2, 6, 10, 3, 7, 11]], ["CA", 2, 3, 8], ["CHR", 1, "shared", [2]], ["CA", 2, 3, 9], ["CHR", 0, "shared", [3]], ["CA", 1, 4, 9], ["FU", 5, [0, 1, 2]], ["AN", 5, 0, 5], ["FU", 5, [1, 2, 3]], ["AN", 5, 1, 4], ["FU", 5, [2, 3, 4]], ["AN", 5, 2, 6], ["FU", 3, [0, 1, 2]], ["SP", 3, 0, 128, [4], 1], ["AN", 3, 1, 2], ["FFSP", 3, 0, [3, 2, 1], 1, 1], ["AN", 3, 1, 6], ["FU", 1, [0, 1, 2]], ["SP", 1, 0, 64, [2], 1], ["AN", 1, 1, 2], ["FFSP", 1, 0, [3, 2, 1], 1, 1], ["AN", 1, 1, 6], ["PR", 4, 0, "auto_unroll_max_step$16"]]]], "r": [[4.7117e-05], 0, 1.83885, 1618382047], "v": "v0.6"}
{"i": [["[\"d2a28fdf41e83222456f5a6e5bf8a24a\", 256, 20, 10, 256, 64, 10, 256, 20, 64]", "cuda -keys=cuda,gpu -max_num_threads=1024 -thread_warp_size=32", [-1, 16, 64, 49152, 2147483647, 1024, 8, 32], "", 0, []], [[], [["CHW", 2, "local"], ["SP", 2, 0, 256, [2, 1, 16, 2], 1], ["SP", 2, 5, 20, [1, 1, 2, 10], 1], ["SP", 2, 10, 64, [2, 2, 1, 4], 1], ["SP", 2, 15, 10, [1, 2], 1], ["RE", 2, [0, 5, 10, 1, 6, 11, 2, 7, 12, 15, 16, 3, 8, 13, 17, 4, 9, 14]], ["FSP", 3, 0, 1, 3], ["FSP", 3, 4, 2, 3], ["FSP", 3, 8, 3, 3], ["RE", 3, [0, 4, 8, 1, 5, 9, 2, 6, 10, 3, 7, 11]], ["CA", 2, 3, 8], ["CHR", 1, "shared", [2]], ["CA", 2, 3, 9], ["CHR", 0, "shared", [3]], ["CA", 1, 4, 9], ["FU", 5, [0, 1, 2]], ["AN", 5, 0, 5], ["FU", 5, [1, 2, 3]], ["AN", 5, 1, 4], ["FU", 5, [2, 3, 4]], ["AN", 5, 2, 6], ["FU", 3, [0, 1, 2]], ["SP", 3, 0, 256, [1], 1], ["AN", 3, 1, 2], ["FFSP", 3, 0, [3, 2, 1], 1, 1], ["AN", 3, 1, 6], ["FU", 1, [0, 1, 2]], ["SP", 1, 0, 256, [4], 1], ["AN", 1, 1, 2], ["FFSP", 1, 0, [3, 2, 1], 1, 1], ["AN", 1, 1, 6], ["PR", 4, 0, "auto_unroll_max_step$512"]]]], "r": [[0.00101673], 0, 13.3947, 1618382049], "v": "v0.6"}
{"i": [["[\"d2a28fdf41e83222456f5a6e5bf8a24a\", 256, 20, 10, 256, 64, 10, 256, 20, 64]", "cuda -keys=cuda,gpu -max_num_threads=1024 -thread_warp_size=32", [-1, 16, 64, 49152, 2147483647, 1024, 8, 32], "", 0, []], [[], [["CHW", 2, "local"], ["SP", 2, 0, 256, [1, 1, 1, 16], 1], ["SP", 2, 5, 20, [2, 2, 5, 1], 1], ["SP", 2, 10, 64, [1, 64, 1, 1], 1], ["SP", 2, 15, 10, [2, 1], 1], ["RE", 2, [0, 5, 10, 1, 6, 11, 2, 7, 12, 15, 16, 3, 8, 13, 17, 4, 9, 14]], ["FSP", 3, 0, 1, 3], ["FSP", 3, 4, 2, 3], ["FSP", 3, 8, 3, 3], ["RE", 3, [0, 4, 8, 1, 5, 9, 2, 6, 10, 3, 7, 11]], ["CA", 2, 3, 8], ["CHR", 1, "shared", [2]], ["CA", 2, 3, 9], ["CHR", 0, "shared", [3]], ["CA", 1, 4, 9], ["FU", 5, [0, 1, 2]], ["AN", 5, 0, 5], ["FU", 5, [1, 2, 3]], ["AN", 5, 1, 4], ["FU", 5, [2, 3, 4]], ["AN", 5, 2, 6], ["FU", 3, [0, 1, 2]], ["SP", 3, 0, 32, [2], 1], ["AN", 3, 1, 2], ["FFSP", 3, 0, [3, 2, 1], 1, 1], ["AN", 3, 1, 6], ["FU", 1, [0, 1, 2]], ["SP", 1, 0, 160, [1], 1], ["AN", 1, 1, 2], ["FFSP", 1, 0, [3, 2, 1], 1, 1], ["AN", 1, 1, 6], ["PR", 4, 0, "auto_unroll_max_step$0"]]]], "r": [[9.606e-06], 0, 1.8014, 1618382050], "v": "v0.6"}
{"i": [["[\"d2a28fdf41e83222456f5a6e5bf8a24a\", 256, 20, 10, 256, 64, 10, 256, 20, 64]", "cuda -keys=cuda,gpu -max_num_threads=1024 -thread_warp_size=32", [-1, 16, 64, 49152, 2147483647, 1024, 8, 32], "", 0, []], [[], [["CHW", 2, "local"], ["SP", 2, 0, 256, [2, 2, 1, 2], 1], ["SP", 2, 5, 20, [1, 5, 2, 2], 1], ["SP", 2, 10, 64, [2, 4, 1, 2], 1], ["SP", 2, 15, 10, [1, 10], 1], ["RE", 2, [0, 5, 10, 1, 6, 11, 2, 7, 12, 15, 16, 3, 8, 13, 17, 4, 9, 14]], ["FSP", 3, 0, 1, 3], ["FSP", 3, 4, 2, 3], ["FSP", 3, 8, 3, 3], ["RE", 3, [0, 4, 8, 1, 5, 9, 2, 6, 10, 3, 7, 11]], ["CA", 2, 3, 8], ["CHR", 1, "shared", [2]], ["CA", 2, 3, 9], ["CHR", 0, "shared", [3]], ["CA", 1, 4, 9], ["FU", 5, [0, 1, 2]], ["AN", 5, 0, 5], ["FU", 5, [1, 2, 3]], ["AN", 5, 1, 4], ["FU", 5, [2, 3, 4]], ["AN", 5, 2, 6], ["FU", 3, [0, 1, 2]], ["SP", 3, 0, 8, [1], 1], ["AN", 3, 1, 2], ["FFSP", 3, 0, [3, 2, 1], 1, 1], ["AN", 3, 1, 6], ["FU", 1, [0, 1, 2]], ["SP", 1, 0, 16, [1], 1], ["AN", 1, 1, 2], ["FFSP", 1, 0, [3, 2, 1], 1, 1], ["AN", 1, 1, 6], ["PR", 4, 0, "auto_unroll_max_step$64"]]]], "r": [[7.77709e-06], 0, 1.79851, 1618382052], "v": "v0.6"}
{"i": [["[\"d2a28fdf41e83222456f5a6e5bf8a24a\", 256, 20, 10, 256, 64, 10, 256, 20, 64]", "cuda -keys=cuda,gpu -max_num_threads=1024 -thread_warp_size=32", [-1, 16, 64, 49152, 2147483647, 1024, 8, 32], "", 0, []], [[], [["CHW", 2, "local"], ["SP", 2, 0, 256, [1, 64, 1, 1], 1], ["SP", 2, 5, 20, [1, 1, 2, 1], 1], ["SP", 2, 10, 64, [1, 1, 4, 16], 1], ["SP", 2, 15, 10, [1, 2], 1], ["RE", 2, [0, 5, 10, 1, 6, 11, 2, 7, 12, 15, 16, 3, 8, 13, 17, 4, 9, 14]], ["FSP", 3, 0, 1, 3], ["FSP", 3, 4, 2, 3], ["FSP", 3, 8, 3, 3], ["RE", 3, [0, 4, 8, 1, 5, 9, 2, 6, 10, 3, 7, 11]], ["CA", 2, 3, 8], ["CHR", 1, "shared", [2]], ["CA", 2, 3, 9], ["CHR", 0, "shared", [3]], ["CA", 1, 4, 9], ["FU", 5, [0, 1, 2]], ["AN", 5, 0, 5], ["FU", 5, [1, 2, 3]], ["AN", 5, 1, 4], ["FU", 5, [2, 3, 4]], ["AN", 5, 2, 6], ["FU", 3, [0, 1, 2]], ["SP", 3, 0, 128, [1], 1], ["AN", 3, 1, 2], ["FFSP", 3, 0, [3, 2, 1], 1, 1], ["AN", 3, 1, 6], ["FU", 1, [0, 1, 2]], ["SP", 1, 0, 4, [4], 1], ["AN", 1, 1, 2], ["FFSP", 1, 0, [3, 2, 1], 1, 1], ["AN", 1, 1, 6], ["PR", 4, 0, "auto_unroll_max_step$0"]]]], "r": [[6.17331e-05], 0, 1.84405, 1618382053], "v": "v0.6"}
{"i": [["[\"d2a28fdf41e83222456f5a6e5bf8a24a\", 256, 20, 10, 256, 64, 10, 256, 20, 64]", "cuda -keys=cuda,gpu -max_num_threads=1024 -thread_warp_size=32", [-1, 16, 64, 49152, 2147483647, 1024, 8, 32], "", 0, []], [[], [["CHW", 2, "local"], ["SP", 2, 0, 256, [2, 8, 2, 1], 1], ["SP", 2, 5, 20, [1, 20, 1, 1], 1], ["SP", 2, 10, 64, [1, 2, 1, 8], 1], ["SP", 2, 15, 10, [5, 2], 1], ["RE", 2, [0, 5, 10, 1, 6, 11, 2, 7, 12, 15, 16, 3, 8, 13, 17, 4, 9, 14]], ["FSP", 3, 0, 1, 3], ["FSP", 3, 4, 2, 3], ["FSP", 3, 8, 3, 3], ["RE", 3, [0, 4, 8, 1, 5, 9, 2, 6, 10, 3, 7, 11]], ["CA", 2, 3, 8], ["CHR", 1, "shared", [2]], ["CA", 2, 3, 9], ["CHR", 0, "shared", [3]], ["CA", 1, 4, 9], ["FU", 5, [0, 1, 2]], ["AN", 5, 0, 5], ["FU", 5, [1, 2, 3]], ["AN", 5, 1, 4], ["FU", 5, [2, 3, 4]], ["AN", 5, 2, 6], ["FU", 3, [0, 1, 2]], ["SP", 3, 0, 160, [40], 1], ["AN", 3, 1, 2], ["FFSP", 3, 0, [3, 2, 1], 1, 1], ["AN", 3, 1, 6], ["FU", 1, [0, 1, 2]], ["SP", 1, 0, 100, [25], 1], ["AN", 1, 1, 2], ["FFSP", 1, 0, [3, 2, 1], 1, 1], ["AN", 1, 1, 6], ["PR", 4, 0, "auto_unroll_max_step$0"]]]], "r": [[1.55087e-05], 0, 1.76394, 1618382054], "v": "v0.6"}
{"i": [["[\"f2143630c0e47adc6f0a73f09f4a8288\", 256, 20, 10, 256, 20, 10]", "cuda -keys=cuda,gpu -max_num_threads=1024 -thread_warp_size=32", [-1, 16, 64, 49152, 2147483647, 1024, 8, 32], "", 0, []], [[], [["CI", 2], ["FU", 4, [0, 1, 2]], ["SP", 4, 0, 51200, [64], 1], ["AN", 4, 0, 5], ["AN", 4, 1, 6], ["FU", 3, [0, 1]], ["SP", 3, 0, 5120, [64], 1], ["AN", 3, 0, 5], ["AN", 3, 1, 6], ["FU", 1, [0, 1]], ["SP", 1, 0, 5120, [32], 1], ["AN", 1, 0, 5], ["AN", 1, 1, 6], ["PR", 1, 0, "auto_unroll_max_step$64"], ["PR", 3, 0, "auto_unroll_max_step$512"]]]], "r": [[5.29238e-06], 0, 1.79987, 1618382063], "v": "v0.6"}
{"i": [["[\"f2143630c0e47adc6f0a73f09f4a8288\", 256, 20, 10, 256, 20, 10]", "cuda -keys=cuda,gpu -max_num_threads=1024 -thread_warp_size=32", [-1, 16, 64, 49152, 2147483647, 1024, 8, 32], "", 0, []], [[], [["CI", 2], ["FU", 4, [0, 1, 2]], ["SP", 4, 0, 51200, [32], 1], ["AN", 4, 0, 5], ["AN", 4, 1, 6], ["FU", 3, [0, 1]], ["SP", 3, 0, 5120, [32], 1], ["AN", 3, 0, 5], ["AN", 3, 1, 6], ["FU", 1, [0, 1]], ["SP", 1, 0, 5120, [32], 1], ["AN", 1, 0, 5], ["AN", 1, 1, 6], ["PR", 1, 0, "auto_unroll_max_step$1024"], ["PR", 3, 0, "auto_unroll_max_step$16"]]]], "r": [[5.64722e-06], 0, 1.75131, 1618382064], "v": "v0.6"}
{"i": [["[\"f2143630c0e47adc6f0a73f09f4a8288\", 256, 20, 10, 256, 20, 10]", "cuda -keys=cuda,gpu -max_num_threads=1024 -thread_warp_size=32", [-1, 16, 64, 49152, 2147483647, 1024, 8, 32], "", 0, []], [[], [["CI", 2], ["FU", 4, [0, 1, 2]], ["SP", 4, 0, 51200, [2], 1], ["AN", 4, 0, 5], ["AN", 4, 1, 6], ["FU", 3, [0, 1]], ["SP", 3, 0, 5120, [64], 1], ["AN", 3, 0, 5], ["AN", 3, 1, 6], ["FU", 1, [0, 1]], ["SP", 1, 0, 5120, [8], 1], ["AN", 1, 0, 5], ["AN", 1, 1, 6], ["PR", 1, 0, "auto_unroll_max_step$512"], ["PR", 3, 0, "auto_unroll_max_step$16"]]]], "r": [[1.97279e-05], 0, 1.62041, 1618382066], "v": "v0.6"}
{"i": [["[\"f2143630c0e47adc6f0a73f09f4a8288\", 256, 20, 10, 256, 20, 10]", "cuda -keys=cuda,gpu -max_num_threads=1024 -thread_warp_size=32", [-1, 16, 64, 49152, 2147483647, 1024, 8, 32], "", 0, []], [[], [["CI", 2], ["FU", 4, [0, 1, 2]], ["SP", 4, 0, 51200, [32], 1], ["AN", 4, 0, 5], ["AN", 4, 1, 6], ["FU", 3, [0, 1]], ["SP", 3, 0, 5120, [32], 1], ["AN", 3, 0, 5], ["AN", 3, 1, 6], ["FU", 1, [0, 1]], ["SP", 1, 0, 5120, [32], 1], ["AN", 1, 0, 5], ["AN", 1, 1, 6], ["PR", 1, 0, "auto_unroll_max_step$64"], ["PR", 3, 0, "auto_unroll_max_step$512"]]]], "r": [[5.62977e-06], 0, 1.41867, 1618382067], "v": "v0.6"}
{"i": [["[\"f2143630c0e47adc6f0a73f09f4a8288\", 256, 20, 10, 256, 20, 10]", "cuda -keys=cuda,gpu -max_num_threads=1024 -thread_warp_size=32", [-1, 16, 64, 49152, 2147483647, 1024, 8, 32], "", 0, []], [[], [["CI", 2], ["FU", 4, [0, 1, 2]], ["SP", 4, 0, 51200, [64], 1], ["AN", 4, 0, 5], ["AN", 4, 1, 6], ["FU", 3, [0, 1]], ["SP", 3, 0, 5120, [32], 1], ["AN", 3, 0, 5], ["AN", 3, 1, 6], ["FU", 1, [0, 1]], ["SP", 1, 0, 5120, [32], 1], ["AN", 1, 0, 5], ["AN", 1, 1, 6], ["PR", 1, 0, "auto_unroll_max_step$512"], ["PR", 3, 0, "auto_unroll_max_step$64"]]]], "r": [[5.2506e-06], 0, 1.36503, 1618382068], "v": "v0.6"}
{"i": [["[\"f2143630c0e47adc6f0a73f09f4a8288\", 256, 20, 10, 256, 20, 10]", "cuda -keys=cuda,gpu -max_num_threads=1024 -thread_warp_size=32", [-1, 16, 64, 49152, 2147483647, 1024, 8, 32], "", 0, []], [[], [["CI", 2], ["FU", 4, [0, 1, 2]], ["SP", 4, 0, 51200, [64], 1], ["AN", 4, 0, 5], ["AN", 4, 1, 6], ["FU", 3, [0, 1]], ["SP", 3, 0, 5120, [32], 1], ["AN", 3, 0, 5], ["AN", 3, 1, 6], ["FU", 1, [0, 1]], ["SP", 1, 0, 5120, [64], 1], ["AN", 1, 0, 5], ["AN", 1, 1, 6], ["PR", 1, 0, "auto_unroll_max_step$64"], ["PR", 3, 0, "auto_unroll_max_step$1024"]]]], "r": [[5.20168e-06], 0, 1.42361, 1618382069], "v": "v0.6"}
{"i": [["[\"f2143630c0e47adc6f0a73f09f4a8288\", 256, 20, 10, 256, 20, 10]", "cuda -keys=cuda,gpu -max_num_threads=1024 -thread_warp_size=32", [-1, 16, 64, 49152, 2147483647, 1024, 8, 32], "", 0, []], [[], [["CI", 2], ["FU", 4, [0, 1, 2]], ["SP", 4, 0, 51200, [32], 1], ["AN", 4, 0, 5], ["AN", 4, 1, 6], ["FU", 3, [0, 1]], ["SP", 3, 0, 5120, [16], 1], ["AN", 3, 0, 5], ["AN", 3, 1, 6], ["FU", 1, [0, 1]], ["SP", 1, 0, 5120, [64], 1], ["AN", 1, 0, 5], ["AN", 1, 1, 6], ["PR", 1, 0, "auto_unroll_max_step$16"], ["PR", 3, 0, "auto_unroll_max_step$0"]]]], "r": [[5.71716e-06], 0, 1.45459, 1618382070], "v": "v0.6"}
{"i": [["[\"f2143630c0e47adc6f0a73f09f4a8288\", 256, 20, 10, 256, 20, 10]", "cuda -keys=cuda,gpu -max_num_threads=1024 -thread_warp_size=32", [-1, 16, 64, 49152, 2147483647, 1024, 8, 32], "", 0, []], [[], [["CI", 2], ["FU", 4, [0, 1, 2]], ["SP", 4, 0, 51200, [32], 1], ["AN", 4, 0, 5], ["AN", 4, 1, 6], ["FU", 3, [0, 1]], ["SP", 3, 0, 5120, [32], 1], ["AN", 3, 0, 5], ["AN", 3, 1, 6], ["FU", 1, [0, 1]], ["SP", 1, 0, 5120, [32], 1], ["AN", 1, 0, 5], ["AN", 1, 1, 6], ["PR", 1, 0, "auto_unroll_max_step$512"], ["PR", 3, 0, "auto_unroll_max_step$1024"]]]], "r": [[5.60403e-06], 0, 1.43851, 1618382071], "v": "v0.6"}
{"i": [["[\"d2a28fdf41e83222456f5a6e5bf8a24a\", 256, 20, 64, 256, 10, 64, 256, 20, 10]", "cuda -keys=cuda,gpu -max_num_threads=1024 -thread_warp_size=32", [-1, 16, 64, 49152, 2147483647, 1024, 8, 32], "", 0, []], [[], [["CHW", 2, "local"], ["SP", 2, 0, 256, [1, 1, 1, 16], 1], ["SP", 2, 5, 20, [1, 10, 2, 1], 1], ["SP", 2, 10, 10, [1, 1, 2, 1], 1], ["SP", 2, 15, 64, [1, 4], 1], ["RE", 2, [0, 5, 10, 1, 6, 11, 2, 7, 12, 15, 16, 3, 8, 13, 17, 4, 9, 14]], ["FSP", 3, 0, 1, 3], ["FSP", 3, 4, 2, 3], ["FSP", 3, 8, 3, 3], ["RE", 3, [0, 4, 8, 1, 5, 9, 2, 6, 10, 3, 7, 11]], ["CA", 2, 3, 8], ["CHR", 1, "shared", [2]], ["CA", 2, 3, 9], ["CHR", 0, "shared", [3]], ["CA", 1, 4, 9], ["FU", 5, [0, 1, 2]], ["AN", 5, 0, 5], ["FU", 5, [1, 2, 3]], ["AN", 5, 1, 4], ["FU", 5, [2, 3, 4]], ["AN", 5, 2, 6], ["FU", 3, [0, 1, 2]], ["SP", 3, 0, 16, [1], 1], ["AN", 3, 1, 2], ["FFSP", 3, 0, [3, 2, 1], 1, 1], ["AN", 3, 1, 6], ["FU", 1, [0, 1, 2]], ["SP", 1, 0, 16, [1], 1], ["AN", 1, 1, 2], ["FFSP", 1, 0, [3, 2, 1], 1, 1], ["AN", 1, 1, 6], ["PR", 4, 0, "auto_unroll_max_step$64"]]]], "r": [[6.74991e-05], 0, 1.66905, 1618382077], "v": "v0.6"}
{"i": [["[\"d2a28fdf41e83222456f5a6e5bf8a24a\", 256, 20, 64, 256, 10, 64, 256, 20, 10]", "cuda -keys=cuda,gpu -max_num_threads=1024 -thread_warp_size=32", [-1, 16, 64, 49152, 2147483647, 1024, 8, 32], "", 0, []], [[], [["CHW", 2, "local"], ["SP", 2, 0, 256, [1, 16, 4, 2], 1], ["SP", 2, 5, 20, [1, 20, 1, 1], 1], ["SP", 2, 10, 10, [1, 1, 10, 1], 1], ["SP", 2, 15, 64, [1, 1], 1], ["RE", 2, [0, 5, 10, 1, 6, 11, 2, 7, 12, 15, 16, 3, 8, 13, 17, 4, 9, 14]], ["FSP", 3, 0, 1, 3], ["FSP", 3, 4, 2, 3], ["FSP", 3, 8, 3, 3], ["RE", 3, [0, 4, 8, 1, 5, 9, 2, 6, 10, 3, 7, 11]], ["CA", 2, 3, 8], ["CHR", 1, "shared", [2]], ["CA", 2, 3, 9], ["CHR", 0, "shared", [3]], ["CA", 1, 4, 9], ["FU", 5, [0, 1, 2]], ["AN", 5, 0, 5], ["FU", 5, [1, 2, 3]], ["AN", 5, 1, 4], ["FU", 5, [2, 3, 4]], ["AN", 5, 2, 6], ["FU", 3, [0, 1, 2]], ["SP", 3, 0, 160, [1], 1], ["AN", 3, 1, 2], ["FFSP", 3, 0, [3, 2, 1], 1, 1], ["AN", 3, 1, 6], ["FU", 1, [0, 1, 2]], ["SP", 1, 0, 80, [1], 1], ["AN", 1, 1, 2], ["FFSP", 1, 0, [3, 2, 1], 1, 1], ["AN", 1, 1, 6], ["PR", 4, 0, "auto_unroll_max_step$1024"]]]], "r": [[0.000186192], 0, 1.7828, 1618382078], "v": "v0.6"}
{"i": [["[\"d2a28fdf41e83222456f5a6e5bf8a24a\", 256, 20, 64, 256, 10, 64, 256, 20, 10]", "cuda -keys=cuda,gpu -max_num_threads=1024 -thread_warp_size=32", [-1, 16, 64, 49152, 2147483647, 1024, 8, 32], "", 0, []], [[], [["CHW", 2, "local"], ["SP", 2, 0, 256, [1, 8, 2, 1], 1], ["SP", 2, 5, 20, [1, 20, 1, 1], 1], ["SP", 2, 10, 10, [1, 5, 1, 1], 1], ["SP", 2, 15, 64, [4, 1], 1], ["RE", 2, [0, 5, 10, 1, 6, 11, 2, 7, 12, 15, 16, 3, 8, 13, 17, 4, 9, 14]], ["FSP", 3, 0, 1, 3], ["FSP", 3, 4, 2, 3], ["FSP", 3, 8, 3, 3], ["RE", 3, [0, 4, 8, 1, 5, 9, 2, 6, 10, 3, 7, 11]], ["CA", 2, 3, 8], ["CHR", 1, "shared", [2]], ["CA", 2, 3, 9], ["CHR", 0, "shared", [3]], ["CA", 1, 4, 9], ["FU", 5, [0, 1, 2]], ["AN", 5, 0, 5], ["FU", 5, [1, 2, 3]], ["AN", 5, 1, 4], ["FU", 5, [2, 3, 4]], ["AN", 5, 2, 6], ["FU", 3, [0, 1, 2]], ["SP", 3, 0, 8, [1], 1], ["AN", 3, 1, 2], ["FFSP", 3, 0, [3, 2, 1], 1, 1], ["AN", 3, 1, 6], ["FU", 1, [0, 1, 2]], ["SP", 1, 0, 8, [4], 1], ["AN", 1, 1, 2], ["FFSP", 1, 0, [3, 2, 1], 1, 1], ["AN", 1, 1, 6], ["PR", 4, 0, "auto_unroll_max_step$512"]]]], "r": [[1.31497e-05], 0, 1.72753, 1618382079], "v": "v0.6"}
{"i": [["[\"d2a28fdf41e83222456f5a6e5bf8a24a\", 256, 20, 64, 256, 10, 64, 256, 20, 10]", "cuda -keys=cuda,gpu -max_num_threads=1024 -thread_warp_size=32", [-1, 16, 64, 49152, 2147483647, 1024, 8, 32], "", 0, []], [[], [["CHW", 2, "local"], ["SP", 2, 0, 256, [1, 16, 1, 1], 1], ["SP", 2, 5, 20, [1, 10, 1, 1], 1], ["SP", 2, 10, 10, [1, 1, 5, 2], 1], ["SP", 2, 15, 64, [1, 4], 1], ["RE", 2, [0, 5, 10, 1, 6, 11, 2, 7, 12, 15, 16, 3, 8, 13, 17, 4, 9, 14]], ["FSP", 3, 0, 1, 3], ["FSP", 3, 4, 2, 3], ["FSP", 3, 8, 3, 3], ["RE", 3, [0, 4, 8, 1, 5, 9, 2, 6, 10, 3, 7, 11]], ["CA", 2, 3, 8], ["CHR", 1, "shared", [2]], ["CA", 2, 3, 9], ["CHR", 0, "shared", [3]], ["CA", 1, 4, 9], ["FU", 5, [0, 1, 2]], ["AN", 5, 0, 5], ["FU", 5, [1, 2, 3]], ["AN", 5, 1, 4], ["FU", 5, [2, 3, 4]], ["AN", 5, 2, 6], ["FU", 3, [0, 1, 2]], ["SP", 3, 0, 80, [2], 1], ["AN", 3, 1, 2], ["FFSP", 3, 0, [3, 2, 1], 1, 1], ["AN", 3, 1, 6], ["FU", 1, [0, 1, 2]], ["SP", 1, 0, 8, [1], 1], ["AN", 1, 1, 2], ["FFSP", 1, 0, [3, 2, 1], 1, 1], ["AN", 1, 1, 6], ["PR", 4, 0, "auto_unroll_max_step$1024"]]]], "r": [[7.84277e-06], 0, 2.1597, 1618382080], "v": "v0.6"}
{"i": [["[\"d2a28fdf41e83222456f5a6e5bf8a24a\", 256, 20, 64, 256, 10, 64, 256, 20, 10]", "cuda -keys=cuda,gpu -max_num_threads=1024 -thread_warp_size=32", [-1, 16, 64, 49152, 2147483647, 1024, 8, 32], "", 0, []], [[], [["CHW", 2, "local"], ["SP", 2, 0, 256, [1, 8, 4, 2], 1], ["SP", 2, 5, 20, [1, 2, 10, 1], 1], ["SP", 2, 10, 10, [1, 2, 1, 5], 1], ["SP", 2, 15, 64, [2, 1], 1], ["RE", 2, [0, 5, 10, 1, 6, 11, 2, 7, 12, 15, 16, 3, 8, 13, 17, 4, 9, 14]], ["FSP", 3, 0, 1, 3], ["FSP", 3, 4, 2, 3], ["FSP", 3, 8, 3, 3], ["RE", 3, [0, 4, 8, 1, 5, 9, 2, 6, 10, 3, 7, 11]], ["CA", 2, 3, 8], ["CHR", 1, "shared", [2]], ["CA", 2, 3, 9], ["CHR", 0, "shared", [3]], ["CA", 1, 4, 9], ["FU", 5, [0, 1, 2]], ["AN", 5, 0, 5], ["FU", 5, [1, 2, 3]], ["AN", 5, 1, 4], ["FU", 5, [2, 3, 4]], ["AN", 5, 2, 6], ["FU", 3, [0, 1, 2]], ["SP", 3, 0, 80, [1], 1], ["AN", 3, 1, 2], ["FFSP", 3, 0, [3, 2, 1], 1, 1], ["AN", 3, 1, 6], ["FU", 1, [0, 1, 2]], ["SP", 1, 0, 160, [32], 1], ["AN", 1, 1, 2], ["FFSP", 1, 0, [3, 2, 1], 1, 1], ["AN", 1, 1, 6], ["PR", 4, 0, "auto_unroll_max_step$16"]]]], "r": [[0.000416828], 0, 2.0903, 1618382082], "v": "v0.6"}
{"i": [["[\"d2a28fdf41e83222456f5a6e5bf8a24a\", 256, 20, 64, 256, 10, 64, 256, 20, 10]", "cuda -keys=cuda,gpu -max_num_threads=1024 -thread_warp_size=32", [-1, 16, 64, 49152, 2147483647, 1024, 8, 32], "", 0, []], [[], [["CHW", 2, "local"], ["SP", 2, 0, 256, [1, 4, 1, 2], 1], ["SP", 2, 5, 20, [1, 2, 1, 1], 1], ["SP", 2, 10, 10, [1, 2, 1, 1], 1], ["SP", 2, 15, 64, [4, 2], 1], ["RE", 2, [0, 5, 10, 1, 6, 11, 2, 7, 12, 15, 16, 3, 8, 13, 17, 4, 9, 14]], ["FSP", 3, 0, 1, 3], ["FSP", 3, 4, 2, 3], ["FSP", 3, 8, 3, 3], ["RE", 3, [0, 4, 8, 1, 5, 9, 2, 6, 10, 3, 7, 11]], ["CA", 2, 3, 8], ["CHR", 1, "shared", [2]], ["CA", 2, 3, 9], ["CHR", 0, "shared", [3]], ["CA", 1, 4, 9], ["FU", 5, [0, 1, 2]], ["AN", 5, 0, 5], ["FU", 5, [1, 2, 3]], ["AN", 5, 1, 4], ["FU", 5, [2, 3, 4]], ["AN", 5, 2, 6], ["FU", 3, [0, 1, 2]], ["SP", 3, 0, 16, [1], 1], ["AN", 3, 1, 2], ["FFSP", 3, 0, [3, 2, 1], 1, 1], ["AN", 3, 1, 6], ["FU", 1, [0, 1, 2]], ["SP", 1, 0, 16, [1], 1], ["AN", 1, 1, 2], ["FFSP", 1, 0, [3, 2, 1], 1, 1], ["AN", 1, 1, 6], ["PR", 4, 0, "auto_unroll_max_step$0"]]]], "r": [[1.90209e-05], 0, 1.64258, 1618382083], "v": "v0.6"}
{"i": [["[\"d2a28fdf41e83222456f5a6e5bf8a24a\", 256, 20, 64, 256, 10, 64, 256, 20, 10]", "cuda -keys=cuda,gpu -max_num_threads=1024 -thread_warp_size=32", [-1, 16, 64, 49152, 2147483647, 1024, 8, 32], "", 0, []], [[], [["CHW", 2, "local"], ["SP", 2, 0, 256, [2, 16, 1, 1], 1], ["SP", 2, 5, 20, [1, 2, 1, 2], 1], ["SP", 2, 10, 10, [2, 1, 1, 5], 1], ["SP", 2, 15, 64, [1, 1], 1], ["RE", 2, [0, 5, 10, 1, 6, 11, 2, 7, 12, 15, 16, 3, 8, 13, 17, 4, 9, 14]], ["FSP", 3, 0, 1, 3], ["FSP", 3, 4, 2, 3], ["FSP", 3, 8, 3, 3], ["RE", 3, [0, 4, 8, 1, 5, 9, 2, 6, 10, 3, 7, 11]], ["CA", 2, 3, 8], ["CHR", 1, "shared", [2]], ["CA", 2, 3, 9], ["CHR", 0, "shared", [3]], ["CA", 1, 4, 9], ["FU", 5, [0, 1, 2]], ["AN", 5, 0, 5], ["FU", 5, [1, 2, 3]], ["AN", 5, 1, 4], ["FU", 5, [2, 3, 4]], ["AN", 5, 2, 6], ["FU", 3, [0, 1, 2]], ["SP", 3, 0, 40, [1], 1], ["AN", 3, 1, 2], ["FFSP", 3, 0, [3, 2, 1], 1, 1], ["AN", 3, 1, 6], ["FU", 1, [0, 1, 2]], ["SP", 1, 0, 16, [1], 1], ["AN", 1, 1, 2], ["FFSP", 1, 0, [3, 2, 1], 1, 1], ["AN", 1, 1, 6], ["PR", 4, 0, "auto_unroll_max_step$512"]]]], "r": [[4.56607e-05], 0, 1.70857, 1618382084], "v": "v0.6"}
{"i": [["[\"d2a28fdf41e83222456f5a6e5bf8a24a\", 256, 20, 64, 256, 10, 64, 256, 20, 10]", "cuda -keys=cuda,gpu -max_num_threads=1024 -thread_warp_size=32", [-1, 16, 64, 49152, 2147483647, 1024, 8, 32], "", 0, []], [[], [["CHW", 2, "local"], ["SP", 2, 0, 256, [2, 8, 2, 1], 1], ["SP", 2, 5, 20, [1, 10, 2, 1], 1], ["SP", 2, 10, 10, [1, 1, 2, 1], 1], ["SP", 2, 15, 64, [4, 4], 1], ["RE", 2, [0, 5, 10, 1, 6, 11, 2, 7, 12, 15, 16, 3, 8, 13, 17, 4, 9, 14]], ["FSP", 3, 0, 1, 3], ["FSP", 3, 4, 2, 3], ["FSP", 3, 8, 3, 3], ["RE", 3, [0, 4, 8, 1, 5, 9, 2, 6, 10, 3, 7, 11]], ["CA", 2, 3, 8], ["CHR", 1, "shared", [2]], ["CA", 2, 3, 9], ["CHR", 0, "shared", [3]], ["CA", 1, 4, 9], ["FU", 5, [0, 1, 2]], ["AN", 5, 0, 5], ["FU", 5, [1, 2, 3]], ["AN", 5, 1, 4], ["FU", 5, [2, 3, 4]], ["AN", 5, 2, 6], ["FU", 3, [0, 1, 2]], ["SP", 3, 0, 16, [1], 1], ["AN", 3, 1, 2], ["FFSP", 3, 0, [3, 2, 1], 1, 1], ["AN", 3, 1, 6], ["FU", 1, [0, 1, 2]], ["SP", 1, 0, 16, [1], 1], ["AN", 1, 1, 2], ["FFSP", 1, 0, [3, 2, 1], 1, 1], ["AN", 1, 1, 6], ["PR", 4, 0, "auto_unroll_max_step$64"]]]], "r": [[2.23626e-05], 0, 1.77071, 1618382085], "v": "v0.6"}
{"i": [["[\"2e6f25a1f8b7c5e74cd8f3f5042bd29c\", 20, 32, 512, 1, 512, 512, 512, 20, 32, 512]", "cuda -keys=cuda,gpu -max_num_threads=1024 -thread_warp_size=32", [-1, 16, 64, 49152, 2147483647, 1024, 8, 32], "", 0, []], [[], [["CI", 5], ["CI", 4], ["SP", 2, 0, 20, [1, 4, 5, 1], 1], ["SP", 2, 5, 32, [2, 1, 1, 1], 1], ["SP", 2, 10, 512, [2, 16, 4, 4], 1], ["SP", 2, 15, 512, [16, 1], 1], ["RE", 2, [0, 5, 10, 1, 6, 11, 2, 7, 12, 15, 16, 3, 8, 13, 17, 4, 9, 14]], ["FSP", 6, 0, 2, 3], ["FSP", 6, 4, 3, 3], ["FSP", 6, 8, 4, 3], ["RE", 6, [0, 4, 8, 1, 5, 9, 2, 6, 10, 3, 7, 11]], ["CA", 2, 6, 8], ["CHR", 1, "shared", [2]], ["CA", 2, 3, 9], ["CHR", 0, "shared", [3]], ["CA", 1, 4, 9], ["FU", 8, [0, 1, 2]], ["AN", 8, 0, 5], ["FU", 8, [1, 2, 3]], ["AN", 8, 1, 4], ["FU", 8, [2, 3, 4]], ["AN", 8, 2, 6], ["FU", 3, [0, 1, 2]], ["SP", 3, 0, 256, [1], 1], ["AN", 3, 1, 2], ["FFSP", 3, 0, [4, 3, 2], 1, 1], ["AN", 3, 1, 6], ["FU", 1, [0, 1, 2]], ["SP", 1, 0, 80, [40], 1], ["AN", 1, 1, 2], ["FFSP", 1, 0, [4, 3, 2], 1, 1], ["AN", 1, 1, 6], ["PR", 4, 0, "auto_unroll_max_step$0"]]]], "r": [[0.00225052], 0, 1.86878, 1618382094], "v": "v0.6"}
{"i": [["[\"2e6f25a1f8b7c5e74cd8f3f5042bd29c\", 20, 32, 512, 1, 512, 512, 512, 20, 32, 512]", "cuda -keys=cuda,gpu -max_num_threads=1024 -thread_warp_size=32", [-1, 16, 64, 49152, 2147483647, 1024, 8, 32], "", 0, []], [[], [["CI", 5], ["CI", 4], ["SP", 2, 0, 20, [4, 1, 5, 1], 1], ["SP", 2, 5, 32, [2, 2, 1, 2], 1], ["SP", 2, 10, 512, [1, 16, 1, 16], 1], ["SP", 2, 15, 512, [1, 2], 1], ["RE", 2, [0, 5, 10, 1, 6, 11, 2, 7, 12, 15, 16, 3, 8, 13, 17, 4, 9, 14]], ["FSP", 6, 0, 2, 3], ["FSP", 6, 4, 3, 3], ["FSP", 6, 8, 4, 3], ["RE", 6, [0, 4, 8, 1, 5, 9, 2, 6, 10, 3, 7, 11]], ["CA", 2, 6, 8], ["CHR", 1, "shared", [2]], ["CA", 2, 3, 9], ["CHR", 0, "shared", [3]], ["CA", 1, 4, 9], ["FU", 8, [0, 1, 2]], ["AN", 8, 0, 5], ["FU", 8, [1, 2, 3]], ["AN", 8, 1, 4], ["FU", 8, [2, 3, 4]], ["AN", 8, 2, 6], ["FU", 3, [0, 1, 2]], ["SP", 3, 0, 8, [1], 1], ["AN", 3, 1, 2], ["FFSP", 3, 0, [4, 3, 2], 1, 1], ["AN", 3, 1, 6], ["FU", 1, [0, 1, 2]], ["SP", 1, 0, 20, [1], 1], ["AN", 1, 1, 2], ["FFSP", 1, 0, [4, 3, 2], 1, 1], ["AN", 1, 1, 6], ["PR", 4, 0, "auto_unroll_max_step$16"]]]], "r": [[0.00297495], 0, 1.94701, 1618382095], "v": "v0.6"}
{"i": [["[\"2e6f25a1f8b7c5e74cd8f3f5042bd29c\", 20, 32, 512, 1, 512, 512, 512, 20, 32, 512]", "cuda -keys=cuda,gpu -max_num_threads=1024 -thread_warp_size=32", [-1, 16, 64, 49152, 2147483647, 1024, 8, 32], "", 0, []], [[], [["CI", 5], ["CI", 4], ["SP", 2, 0, 20, [1, 1, 2, 2], 1], ["SP", 2, 5, 32, [4, 2, 2, 1], 1], ["SP", 2, 10, 512, [1, 128, 1, 1], 1], ["SP", 2, 15, 512, [2, 4], 1], ["RE", 2, [0, 5, 10, 1, 6, 11, 2, 7, 12, 15, 16, 3, 8, 13, 17, 4, 9, 14]], ["FSP", 6, 0, 2, 3], ["FSP", 6, 4, 3, 3], ["FSP", 6, 8, 4, 3], ["RE", 6, [0, 4, 8, 1, 5, 9, 2, 6, 10, 3, 7, 11]], ["CA", 2, 6, 8], ["CHR", 1, "shared", [2]], ["CA", 2, 3, 9], ["CHR", 0, "shared", [3]], ["CA", 1, 4, 9], ["FU", 8, [0, 1, 2]], ["AN", 8, 0, 5], ["FU", 8, [1, 2, 3]], ["AN", 8, 1, 4], ["FU", 8, [2, 3, 4]], ["AN", 8, 2, 6], ["FU", 3, [0, 1, 2]], ["SP", 3, 0, 8, [1], 1], ["AN", 3, 1, 2], ["FFSP", 3, 0, [4, 3, 2], 1, 1], ["AN", 3, 1, 6], ["FU", 1, [0, 1, 2]], ["SP", 1, 0, 64, [2], 1], ["AN", 1, 1, 2], ["FFSP", 1, 0, [4, 3, 2], 1, 1], ["AN", 1, 1, 6], ["PR", 4, 0, "auto_unroll_max_step$16"]]]], "r": [[0.000106275], 0, 1.81843, 1618382096], "v": "v0.6"}
{"i": [["[\"2e6f25a1f8b7c5e74cd8f3f5042bd29c\", 20, 32, 512, 1, 512, 512, 512, 20, 32, 512]", "cuda -keys=cuda,gpu -max_num_threads=1024 -thread_warp_size=32", [-1, 16, 64, 49152, 2147483647, 1024, 8, 32], "", 0, []], [[], [["CI", 5], ["CI", 4], ["SP", 2, 0, 20, [2, 1, 2, 1], 1], ["SP", 2, 5, 32, [1, 1, 2, 2], 1], ["SP", 2, 10, 512, [2, 8, 1, 8], 1], ["SP", 2, 15, 512, [16, 2], 1], ["RE", 2, [0, 5, 10, 1, 6, 11, 2, 7, 12, 15, 16, 3, 8, 13, 17, 4, 9, 14]], ["FSP", 6, 0, 2, 3], ["FSP", 6, 4, 3, 3], ["FSP", 6, 8, 4, 3], ["RE", 6, [0, 4, 8, 1, 5, 9, 2, 6, 10, 3, 7, 11]], ["CA", 2, 6, 8], ["CHR", 1, "shared", [2]], ["CA", 2, 3, 9], ["CHR", 0, "shared", [3]], ["CA", 1, 4, 9], ["FU", 8, [0, 1, 2]], ["AN", 8, 0, 5], ["FU", 8, [1, 2, 3]], ["AN", 8, 1, 4], ["FU", 8, [2, 3, 4]], ["AN", 8, 2, 6], ["FU", 3, [0, 1, 2]], ["SP", 3, 0, 256, [1], 1], ["AN", 3, 1, 2], ["FFSP", 3, 0, [4, 3, 2], 1, 1], ["AN", 3, 1, 6], ["FU", 1, [0, 1, 2]], ["SP", 1, 0, 256, [1], 1], ["AN", 1, 1, 2], ["FFSP", 1, 0, [4, 3, 2], 1, 1], ["AN", 1, 1, 6], ["PR", 4, 0, "auto_unroll_max_step$16"]]]], "r": [[0.00119684], 0, 1.62574, 1618382097], "v": "v0.6"}
{"i": [["[\"2e6f25a1f8b7c5e74cd8f3f5042bd29c\", 20, 32, 512, 1, 512, 512, 512, 20, 32, 512]", "cuda -keys=cuda,gpu -max_num_threads=1024 -thread_warp_size=32", [-1, 16, 64, 49152, 2147483647, 1024, 8, 32], "", 0, []], [[], [["CI", 5], ["CI", 4], ["SP", 2, 0, 20, [1, 2, 1, 5], 1], ["SP", 2, 5, 32, [1, 1, 1, 32], 1], ["SP", 2, 10, 512, [2, 16, 1, 2], 1], ["SP", 2, 15, 512, [1, 2], 1], ["RE", 2, [0, 5, 10, 1, 6, 11, 2, 7, 12, 15, 16, 3, 8, 13, 17, 4, 9, 14]], ["FSP", 6, 0, 2, 3], ["FSP", 6, 4, 3, 3], ["FSP", 6, 8, 4, 3], ["RE", 6, [0, 4, 8, 1, 5, 9, 2, 6, 10, 3, 7, 11]], ["CA", 2, 6, 8], ["CHR", 1, "shared", [2]], ["CA", 2, 3, 9], ["CHR", 0, "shared", [3]], ["CA", 1, 4, 9], ["FU", 8, [0, 1, 2]], ["AN", 8, 0, 5], ["FU", 8, [1, 2, 3]], ["AN", 8, 1, 4], ["FU", 8, [2, 3, 4]], ["AN", 8, 2, 6], ["FU", 3, [0, 1, 2]], ["SP", 3, 0, 4, [1], 1], ["AN", 3, 1, 2], ["FFSP", 3, 0, [4, 3, 2], 1, 1], ["AN", 3, 1, 6], ["FU", 1, [0, 1, 2]], ["SP", 1, 0, 320, [1], 1], ["AN", 1, 1, 2], ["FFSP", 1, 0, [4, 3, 2], 1, 1], ["AN", 1, 1, 6], ["PR", 4, 0, "auto_unroll_max_step$16"]]]], "r": [[0.00247261], 0, 1.55525, 1618382098], "v": "v0.6"}
{"i": [["[\"2e6f25a1f8b7c5e74cd8f3f5042bd29c\", 20, 32, 512, 1, 512, 512, 512, 20, 32, 512]", "cuda -keys=cuda,gpu -max_num_threads=1024 -thread_warp_size=32", [-1, 16, 64, 49152, 2147483647, 1024, 8, 32], "", 0, []], [[], [["CI", 5], ["CI", 4], ["SP", 2, 0, 20, [1, 10, 1, 2], 1], ["SP", 2, 5, 32, [4, 1, 2, 1], 1], ["SP", 2, 10, 512, [1, 16, 1, 8], 1], ["SP", 2, 15, 512, [1, 1], 1], ["RE", 2, [0, 5, 10, 1, 6, 11, 2, 7, 12, 15, 16, 3, 8, 13, 17, 4, 9, 14]], ["FSP", 6, 0, 2, 3], ["FSP", 6, 4, 3, 3], ["FSP", 6, 8, 4, 3], ["RE", 6, [0, 4, 8, 1, 5, 9, 2, 6, 10, 3, 7, 11]], ["CA", 2, 6, 8], ["CHR", 1, "shared", [2]], ["CA", 2, 3, 9], ["CHR", 0, "shared", [3]], ["CA", 1, 4, 9], ["FU", 8, [0, 1, 2]], ["AN", 8, 0, 5], ["FU", 8, [1, 2, 3]], ["AN", 8, 1, 4], ["FU", 8, [2, 3, 4]], ["AN", 8, 2, 6], ["FU", 3, [0, 1, 2]], ["SP", 3, 0, 16, [1], 1], ["AN", 3, 1, 2], ["FFSP", 3, 0, [4, 3, 2], 1, 1], ["AN", 3, 1, 6], ["FU", 1, [0, 1, 2]], ["SP", 1, 0, 16, [1], 1], ["AN", 1, 1, 2], ["FFSP", 1, 0, [4, 3, 2], 1, 1], ["AN", 1, 1, 6], ["PR", 4, 0, "auto_unroll_max_step$64"]]]], "r": [[0.000333507], 0, 1.86424, 1618382099], "v": "v0.6"}
{"i": [["[\"2e6f25a1f8b7c5e74cd8f3f5042bd29c\", 20, 32, 512, 1, 512, 512, 512, 20, 32, 512]", "cuda -keys=cuda,gpu -max_num_threads=1024 -thread_warp_size=32", [-1, 16, 64, 49152, 2147483647, 1024, 8, 32], "", 0, []], [[], [["CI", 5], ["CI", 4], ["SP", 2, 0, 20, [1, 1, 1, 10], 1], ["SP", 2, 5, 32, [8, 4, 1, 1], 1], ["SP", 2, 10, 512, [1, 8, 4, 1], 1], ["SP", 2, 15, 512, [2, 4], 1], ["RE", 2, [0, 5, 10, 1, 6, 11, 2, 7, 12, 15, 16, 3, 8, 13, 17, 4, 9, 14]], ["FSP", 6, 0, 2, 3], ["FSP", 6, 4, 3, 3], ["FSP", 6, 8, 4, 3], ["RE", 6, [0, 4, 8, 1, 5, 9, 2, 6, 10, 3, 7, 11]], ["CA", 2, 6, 8], ["CHR", 1, "shared", [2]], ["CA", 2, 3, 9], ["CHR", 0, "shared", [3]], ["CA", 1, 4, 9], ["FU", 8, [0, 1, 2]], ["AN", 8, 0, 5], ["FU", 8, [1, 2, 3]], ["AN", 8, 1, 4], ["FU", 8, [2, 3, 4]], ["AN", 8, 2, 6], ["FU", 3, [0, 1, 2]], ["SP", 3, 0, 64, [1], 1], ["AN", 3, 1, 2], ["FFSP", 3, 0, [4, 3, 2], 1, 1], ["AN", 3, 1, 6], ["FU", 1, [0, 1, 2]], ["SP", 1, 0, 160, [1], 1], ["AN", 1, 1, 2], ["FFSP", 1, 0, [4, 3, 2], 1, 1], ["AN", 1, 1, 6], ["PR", 4, 0, "auto_unroll_max_step$0"]]]], "r": [[0.000554201], 0, 2.08259, 1618382101], "v": "v0.6"}
{"i": [["[\"2e6f25a1f8b7c5e74cd8f3f5042bd29c\", 20, 32, 512, 1, 512, 512, 512, 20, 32, 512]", "cuda -keys=cuda,gpu -max_num_threads=1024 -thread_warp_size=32", [-1, 16, 64, 49152, 2147483647, 1024, 8, 32], "", 0, []], [[], [["CI", 5], ["CI", 4], ["SP", 2, 0, 20, [1, 2, 1, 5], 1], ["SP", 2, 5, 32, [2, 1, 2, 8], 1], ["SP", 2, 10, 512, [1, 128, 4, 1], 1], ["SP", 2, 15, 512, [8, 1], 1], ["RE", 2, [0, 5, 10, 1, 6, 11, 2, 7, 12, 15, 16, 3, 8, 13, 17, 4, 9, 14]], ["FSP", 6, 0, 2, 3], ["FSP", 6, 4, 3, 3], ["FSP", 6, 8, 4, 3], ["RE", 6, [0, 4, 8, 1, 5, 9, 2, 6, 10, 3, 7, 11]], ["CA", 2, 6, 8], ["CHR", 1, "shared", [2]], ["CA", 2, 3, 9], ["CHR", 0, "shared", [3]], ["CA", 1, 4, 9], ["FU", 8, [0, 1, 2]], ["AN", 8, 0, 5], ["FU", 8, [1, 2, 3]], ["AN", 8, 1, 4], ["FU", 8, [2, 3, 4]], ["AN", 8, 2, 6], ["FU", 3, [0, 1, 2]], ["SP", 3, 0, 32, [2], 1], ["AN", 3, 1, 2], ["FFSP", 3, 0, [4, 3, 2], 1, 1], ["AN", 3, 1, 6], ["FU", 1, [0, 1, 2]], ["SP", 1, 0, 640, [1], 1], ["AN", 1, 1, 2], ["FFSP", 1, 0, [4, 3, 2], 1, 1], ["AN", 1, 1, 6], ["PR", 4, 0, "auto_unroll_max_step$1024"]]]], "r": [[0.00619915], 0, 3.42495, 1618382102], "v": "v0.6"}
{"i": [["[\"d2a28fdf41e83222456f5a6e5bf8a24a\", 256, 20, 20, 256, 64, 20, 256, 20, 64]", "cuda -keys=cuda,gpu -max_num_threads=1024 -thread_warp_size=32", [-1, 16, 64, 49152, 2147483647, 1024, 8, 32], "", 0, []], [[], [["CHW", 2, "local"], ["SP", 2, 0, 256, [1, 2, 1, 8], 1], ["SP", 2, 5, 20, [1, 2, 1, 10], 1], ["SP", 2, 10, 64, [1, 16, 1, 2], 1], ["SP", 2, 15, 20, [4, 1], 1], ["RE", 2, [0, 5, 10, 1, 6, 11, 2, 7, 12, 15, 16, 3, 8, 13, 17, 4, 9, 14]], ["FSP", 3, 0, 1, 3], ["FSP", 3, 4, 2, 3], ["FSP", 3, 8, 3, 3], ["RE", 3, [0, 4, 8, 1, 5, 9, 2, 6, 10, 3, 7, 11]], ["CA", 2, 3, 8], ["CHR", 1, "shared", [2]], ["CA", 2, 3, 9], ["CHR", 0, "shared", [3]], ["CA", 1, 4, 9], ["FU", 5, [0, 1, 2]], ["AN", 5, 0, 5], ["FU", 5, [1, 2, 3]], ["AN", 5, 1, 4], ["FU", 5, [2, 3, 4]], ["AN", 5, 2, 6], ["FU", 3, [0, 1, 2]], ["SP", 3, 0, 32, [1], 1], ["AN", 3, 1, 2], ["FFSP", 3, 0, [3, 2, 1], 1, 1], ["AN", 3, 1, 6], ["FU", 1, [0, 1, 2]], ["SP", 1, 0, 320, [40], 1], ["AN", 1, 1, 2], ["FFSP", 1, 0, [3, 2, 1], 1, 1], ["AN", 1, 1, 6], ["PR", 4, 0, "auto_unroll_max_step$0"]]]], "r": [[2.85167e-05], 0, 1.72323, 1618382109], "v": "v0.6"}
{"i": [["[\"d2a28fdf41e83222456f5a6e5bf8a24a\", 256, 20, 20, 256, 64, 20, 256, 20, 64]", "cuda -keys=cuda,gpu -max_num_threads=1024 -thread_warp_size=32", [-1, 16, 64, 49152, 2147483647, 1024, 8, 32], "", 0, []], [[], [["CHW", 2, "local"], ["SP", 2, 0, 256, [2, 32, 2, 1], 1], ["SP", 2, 5, 20, [1, 4, 1, 1], 1], ["SP", 2, 10, 64, [1, 1, 8, 1], 1], ["SP", 2, 15, 20, [1, 1], 1], ["RE", 2, [0, 5, 10, 1, 6, 11, 2, 7, 12, 15, 16, 3, 8, 13, 17, 4, 9, 14]], ["FSP", 3, 0, 1, 3], ["FSP", 3, 4, 2, 3], ["FSP", 3, 8, 3, 3], ["RE", 3, [0, 4, 8, 1, 5, 9, 2, 6, 10, 3, 7, 11]], ["CA", 2, 3, 8], ["CHR", 1, "shared", [2]], ["CA", 2, 3, 9], ["CHR", 0, "shared", [3]], ["CA", 1, 4, 9], ["FU", 5, [0, 1, 2]], ["AN", 5, 0, 5], ["FU", 5, [1, 2, 3]], ["AN", 5, 1, 4], ["FU", 5, [2, 3, 4]], ["AN", 5, 2, 6], ["FU", 3, [0, 1, 2]], ["SP", 3, 0, 2, [1], 1], ["AN", 3, 1, 2], ["FFSP", 3, 0, [3, 2, 1], 1, 1], ["AN", 3, 1, 6], ["FU", 1, [0, 1, 2]], ["SP", 1, 0, 2, [1], 1], ["AN", 1, 1, 2], ["FFSP", 1, 0, [3, 2, 1], 1, 1], ["AN", 1, 1, 6], ["PR", 4, 0, "auto_unroll_max_step$16"]]]], "r": [[5.78256e-05], 0, 1.74744, 1618382110], "v": "v0.6"}
{"i": [["[\"d2a28fdf41e83222456f5a6e5bf8a24a\", 256, 20, 20, 256, 64, 20, 256, 20, 64]", "cuda -keys=cuda,gpu -max_num_threads=1024 -thread_warp_size=32", [-1, 16, 64, 49152, 2147483647, 1024, 8, 32], "", 0, []], [[], [["CHW", 2, "local"], ["SP", 2, 0, 256, [1, 1, 1, 4], 1], ["SP", 2, 5, 20, [4, 5, 1, 1], 1], ["SP", 2, 10, 64, [1, 16, 1, 2], 1], ["SP", 2, 15, 20, [5, 2], 1], ["RE", 2, [0, 5, 10, 1, 6, 11, 2, 7, 12, 15, 16, 3, 8, 13, 17, 4, 9, 14]], ["FSP", 3, 0, 1, 3], ["FSP", 3, 4, 2, 3], ["FSP", 3, 8, 3, 3], ["RE", 3, [0, 4, 8, 1, 5, 9, 2, 6, 10, 3, 7, 11]], ["CA", 2, 3, 8], ["CHR", 1, "shared", [2]], ["CA", 2, 3, 9], ["CHR", 0, "shared", [3]], ["CA", 1, 4, 9], ["FU", 5, [0, 1, 2]], ["AN", 5, 0, 5], ["FU", 5, [1, 2, 3]], ["AN", 5, 1, 4], ["FU", 5, [2, 3, 4]], ["AN", 5, 2, 6], ["FU", 3, [0, 1, 2]], ["SP", 3, 0, 40, [1], 1], ["AN", 3, 1, 2], ["FFSP", 3, 0, [3, 2, 1], 1, 1], ["AN", 3, 1, 6], ["FU", 1, [0, 1, 2]], ["SP", 1, 0, 40, [1], 1], ["AN", 1, 1, 2], ["FFSP", 1, 0, [3, 2, 1], 1, 1], ["AN", 1, 1, 6], ["PR", 4, 0, "auto_unroll_max_step$512"]]]], "r": [[5.76201e-06], 0, 1.77116, 1618382111], "v": "v0.6"}
{"i": [["[\"d2a28fdf41e83222456f5a6e5bf8a24a\", 256, 20, 20, 256, 64, 20, 256, 20, 64]", "cuda -keys=cuda,gpu -max_num_threads=1024 -thread_warp_size=32", [-1, 16, 64, 49152, 2147483647, 1024, 8, 32], "", 0, []], [[], [["CHW", 2, "local"], ["SP", 2, 0, 256, [1, 1, 1, 4], 1], ["SP", 2, 5, 20, [1, 5, 1, 1], 1], ["SP", 2, 10, 64, [1, 16, 1, 4], 1], ["SP", 2, 15, 20, [10, 1], 1], ["RE", 2, [0, 5, 10, 1, 6, 11, 2, 7, 12, 15, 16, 3, 8, 13, 17, 4, 9, 14]], ["FSP", 3, 0, 1, 3], ["FSP", 3, 4, 2, 3], ["FSP", 3, 8, 3, 3], ["RE", 3, [0, 4, 8, 1, 5, 9, 2, 6, 10, 3, 7, 11]], ["CA", 2, 3, 8], ["CHR", 1, "shared", [2]], ["CA", 2, 3, 9], ["CHR", 0, "shared", [3]], ["CA", 1, 4, 9], ["FU", 5, [0, 1, 2]], ["AN", 5, 0, 5], ["FU", 5, [1, 2, 3]], ["AN", 5, 1, 4], ["FU", 5, [2, 3, 4]], ["AN", 5, 2, 6], ["FU", 3, [0, 1, 2]], ["SP", 3, 0, 160, [40], 1], ["AN", 3, 1, 2], ["FFSP", 3, 0, [3, 2, 1], 1, 1], ["AN", 3, 1, 6], ["FU", 1, [0, 1, 2]], ["SP", 1, 0, 80, [1], 1], ["AN", 1, 1, 2], ["FFSP", 1, 0, [3, 2, 1], 1, 1], ["AN", 1, 1, 6], ["PR", 4, 0, "auto_unroll_max_step$64"]]]], "r": [[3.3936e-05], 0, 1.68472, 1618382113], "v": "v0.6"}
{"i": [["[\"d2a28fdf41e83222456f5a6e5bf8a24a\", 256, 20, 20, 256, 64, 20, 256, 20, 64]", "cuda -keys=cuda,gpu -max_num_threads=1024 -thread_warp_size=32", [-1, 16, 64, 49152, 2147483647, 1024, 8, 32], "", 0, []], [[], [["CHW", 2, "local"], ["SP", 2, 0, 256, [1, 1, 4, 2], 1], ["SP", 2, 5, 20, [5, 1, 2, 1], 1], ["SP", 2, 10, 64, [1, 8, 1, 4], 1], ["SP", 2, 15, 20, [5, 1], 1], ["RE", 2, [0, 5, 10, 1, 6, 11, 2, 7, 12, 15, 16, 3, 8, 13, 17, 4, 9, 14]], ["FSP", 3, 0, 1, 3], ["FSP", 3, 4, 2, 3], ["FSP", 3, 8, 3, 3], ["RE", 3, [0, 4, 8, 1, 5, 9, 2, 6, 10, 3, 7, 11]], ["CA", 2, 3, 8], ["CHR", 1, "shared", [2]], ["CA", 2, 3, 9], ["CHR", 0, "shared", [3]], ["CA", 1, 4, 9], ["FU", 5, [0, 1, 2]], ["AN", 5, 0, 5], ["FU", 5, [1, 2, 3]], ["AN", 5, 1, 4], ["FU", 5, [2, 3, 4]], ["AN", 5, 2, 6], ["FU", 3, [0, 1, 2]], ["SP", 3, 0, 80, [1], 1], ["AN", 3, 1, 2], ["FFSP", 3, 0, [3, 2, 1], 1, 1], ["AN", 3, 1, 6], ["FU", 1, [0, 1, 2]], ["SP", 1, 0, 160, [40], 1], ["AN", 1, 1, 2], ["FFSP", 1, 0, [3, 2, 1], 1, 1], ["AN", 1, 1, 6], ["PR", 4, 0, "auto_unroll_max_step$16"]]]], "r": [[0.00016654], 0, 1.91833, 1618382114], "v": "v0.6"}
